"ID","Previous_accession","moduleLabels","MM.06","p.MM.06","Interpro.ID","Interpro.Short.Description","GO","GO_term","Ontology.Term","Preferred.Name","SP_d3","SP_d7","R12_d7","R34_d7","R56_d7","R78_d7"
"TraesCS6A03G0386200.1","TraesCS6A02G158900","W06","0.849643818623655","1.58344105786734e-05","IPR001757, IPR006121, IPR006122, IPR008250, IPR017969, IPR018303, IPR023214, IPR023298, IPR023299, IPR027256, IPR036163, IPR036412, IPR044492","P_typ_ATPase, HMA_dom, HMA_Cu_ion-bd, ATPase_P-typ_transduc_dom_A_sf, Heavy-metal-associated_CS, ATPase_P-typ_P_site, HAD_sf, ATPase_P-typ_TM_dom_sf, ATPase_P-typ_cyto_dom_N, P-typ_ATPase_IB, HMA_dom_sf, HAD-like_sf, P_typ_ATPase_HD_dom","GO:0016887,GO:0005524,GO:0140581,GO:0005507,GO:0043682,GO:0016021,GO:0005774,GO:0035434,GO:0055070","ATP hydrolysis activity,ATP binding,P-type monovalent copper transporter activity,copper ion binding,P-type divalent copper transporter activity,integral component of membrane,vacuolar membrane,copper ion transmembrane transport,copper ion homeostasis","NA","NA","2.311771519","4.917564793","2.872863772","1.358422913","1.800398645","3.085949307"
"TraesCS6A03G0395000.1","TraesCS6A02G162900","W06","0.92375023010716","1.21538251175676e-07","IPR007736","Caleosin-related","GO:0004497,GO:0005509","monooxygenase activity,calcium ion binding","TO_0000598, TO_0000276, TO_0000183","protein content, drought tolerance, other miscellaneous trait","1.84481001","10.00013476","2.55535096","0.413176844","1.481893419","4.665373564"
"TraesCS6A03G0421200.1","TraesCS6A02G170400","W06","0.72065937116732","0.00109988635301503","IPR002048, IPR011992, IPR018247, IPR041534","EF_hand_dom, EF-hand-dom_pair, EF_Hand_1_Ca_BS, EF-hand_13","GO:0000159,GO:0005509,GO:0019888,GO:0006470,GO:0050790","protein phosphatase type 2A complex,calcium ion binding,protein phosphatase regulator activity,protein dephosphorylation,regulation of catalytic activity","TO_0000183, TO_0000043","other miscellaneous trait, root morphology trait","1.852690274","3.975447938","1.592528768","2.299614466","3.222320685","4.545921319"
"TraesCS6A03G0422500.2","TraesCS6A02G170900","W06","0.603554452974204","0.0103084036142118","IPR022742, IPR029058","Hydrolase_4, AB_hydrolase","NA","NA","NA","NA","0.123403821","0.407886849","0.076224346","0.128605937","0.127347284","0.27107601"
"TraesCS6A03G0481800.1","TraesCS6A02G189600","W06","0.609869801670045","0.00933689540201858","IPR005050","Enod93","GO:0016021","integral component of membrane","NA","NA","0.826527956","1.199810214","0.786714024","0.645915226","1.200289567","1.686178616"
"TraesCS6A03G0579200.1","TraesCS6A02G210100","W06","0.553570073969375","0.0211486634308144","IPR000719, IPR008271, IPR011009","Prot_kinase_dom, Ser/Thr_kinase_AS, Kinase-like_dom_sf","GO:0005634,GO:0004672,GO:0005524,GO:0006468","nucleus,protein kinase activity,ATP binding,protein phosphorylation","TO_0000358, TO_0000112, TO_0000429","female sterility, disease resistance, salt sensitivity","5.153422992","7.114153956","3.208422401","3.72828222","5.459680479","7.720362868"
"TraesCS6A03G0583000.1","TraesCS6A02G212300","W06","0.958933325864546","1.30011477383174e-09","IPR000717, IPR019585, IPR036390, IPR045135","PCI_dom, Rpn7/CSN1, WH_DNA-bd_sf, Rpn7_N","GO:0000502,GO:0005737,GO:0043161","proteasome complex,cytoplasm,proteasome-mediated ubiquitin-dependent protein catabolic process","TO_0020055, TO_0000344, TO_0000137, TO_0000469","wheat stripe rust disease resistance, days to flowering trait, days to heading, days to maturity","4.518379888","7.932111835","4.001264065","2.911157163","5.122241256","8.131252317"
"TraesCS6A03G0592200.1","TraesCS6A02G215300","W06","0.8409754413653","2.34779177276424e-05","IPR005513","LEA_1","GO:0009793","embryo development ending in seed dormancy","TO_0000303","cold tolerance","5.097309057","43.33994289","2.517398736","2.224641393","2.293436083","5.33399245"
"TraesCS6A03G0601000.1","TraesCS6A02G219100","W06","0.672947301603393","0.0030716585612431","","","NA","NA","NA","NA","0.444011712","1.220418849","0.256611776","0.085073336","0.409873983","0.649761291"
"TraesCS6A03G0601600.1","TraesCS6A02G219500","W06","0.85616270839526","1.15840266800487e-05","IPR001985, IPR016067, IPR018166","S-AdoMet_decarboxylase, S-AdoMet_deCO2ase_core, S-AdoMet_deCO2ase_CS","GO:0005829,GO:0004014,GO:0006557,GO:0006597,GO:0008295","cytosol,adenosylmethionine decarboxylase activity,GO:0006557,spermine biosynthetic process,spermidine biosynthetic process","TO_0000276, TO_0000112, TO_0000919, TO_0006001","drought tolerance, disease resistance, grain weight, salt tolerance","22.47064427","132.594876","20.57161276","24.27859934","35.12388206","70.33734913"
"TraesCS6A03G0619600.1","TraesCS6A02G224800","W06","0.756144842411981","0.000444832357386664","IPR000504, IPR012677, IPR034215, IPR035979","RRM_dom, Nucleotide-bd_a/b_plait_sf, RBM42_RRM, RBD_domain_sf","GO:0003729","mRNA binding","NA","NA","3.488882735","7.896472142","4.897468525","2.556203564","2.726464281","3.469924433"
"TraesCS6A03G0640900.1","TraesCS6A02G232900","W06","0.70146920301569","0.00170114764282768","IPR019370","E2F-assoc_phosphoprotein","GO:0005634,GO:0008284","nucleus,positive regulation of cell population proliferation","NA","NA","1.490047933","1.790800382","0.743821186","0.761784415","1.268489628","1.661432803"
"TraesCS6A03G0646500.1","TraesCS6A02G235500","W06","0.798975277764852","0.000119578181229702","IPR002711, IPR003615","HNH, HNH_nuc","GO:0003676,GO:0004519,GO:0090305","nucleic acid binding,endonuclease activity,nucleic acid phosphodiester bond hydrolysis","NA","NA","0.164048445","0.388887575","0.114296937","0.157968976","0.217515092","0.326266518"
"TraesCS6A03G0653000.1","TraesCS6A02G238500","W06","0.756811639688122","0.000436714834823697","IPR001096, IPR043577, IPR046427","Peptidase_C13, AE, Legumain_prodom_sf","GO:0006624,GO:0004197,GO:0005773,GO:0051603","vacuolar protein processing,cysteine-type endopeptidase activity,vacuole,proteolysis involved in protein catabolic process","TO_0002661, TO_0000253, TO_0000430, TO_0000190, TO_0000598, TO_0006002, TO_0000276","seed maturation, seed dormancy, germination rate, seed coat color, protein content, proline content, drought tolerance","2.848640967","7.952184549","1.344921558","2.148061018","3.115479559","4.093649548"
"TraesCS6A03G0682900.1","TraesCS6A02G252500","W06","0.655631608355414","0.00427094272696057","IPR006595, IPR013083, IPR013144, IPR024964, IPR027370, IPR037683, IPR044063, IPR045098","CTLH_C, Znf_RING/FYVE/PHD, CRA_dom, CTLH/CRA, Znf-RING_euk, Rmd5_dRing, ZF_RING_GID, Fyv10_fam","GO:0005634,GO:0043161,GO:0061630,GO:0046872,GO:0005737,GO:0034657,GO:0016567","nucleus,proteasome-mediated ubiquitin-dependent protein catabolic process,ubiquitin protein ligase activity,metal ion binding,cytoplasm,GID complex,protein ubiquitination","TO_0000183, TO_0020055, TO_0000355, TO_0000194","other miscellaneous trait, wheat stripe rust disease resistance, heterosis, globular embryo","1.871894411","2.456163182","1.812682358","1.179709111","2.281247944","2.784510074"
"TraesCS6A03G0684600.1","TraesCS6A02G253300","W06","0.903445319853396","6.72231229991404e-07","IPR000167, IPR030513","Dehydrin, Dehydrin_CS","GO:0009737,GO:0016020,GO:0009631,GO:0009414","response to abscisic acid,membrane,cold acclimation,response to water deprivation","TO_0000355","heterosis","30.64018472","136.3272401","14.24112598","8.261847486","23.37340623","47.25754384"
"TraesCS6A03G0708300.1","TraesCS6A02G264600","W06","0.746513465453153","0.000576827290059936","IPR001623, IPR036869","DnaJ_domain, J_dom_sf","GO:0005783,GO:0016021,GO:0031965,GO:0006488","endoplasmic reticulum,integral component of membrane,nuclear membrane,dolichol-linked oligosaccharide biosynthetic process","NA","NA","1.479617105","5.080896316","1.310633995","0.981635206","1.785729797","3.449751269"
"TraesCS6A03G0714100.1","TraesCS6A02G267100","W06","0.8744155520741","4.42468803858872e-06","","","NA","NA","NA","NA","13.11626192","20.72427003","11.1316912","8.250717121","16.33607634","27.42255629"
"TraesCS6A03G0720000.1","TraesCS6A02G268700","W06","0.685826378077167","0.00237083844060977","IPR000313, IPR044679","PWWP_dom, PWWP2-like","NA","NA","TO_0000194","globular embryo","0.854390852","2.617402526","0.513474675","1.204926676","1.359251666","2.015152195"
"TraesCS6A03G0727100.1","TraesCS6A02G272700","W06","0.851808200519967","1.42968990315911e-05","IPR000073, IPR029058","AB_hydrolase_1, AB_hydrolase","GO:0016021,GO:0016787","integral component of membrane,hydrolase activity","TO_0002661, TO_0000137","seed maturation, days to heading","0.660513527","4.323791611","0.263023033","0.091610208","0.15122682","0.716933704"
"TraesCS6A03G0728600.1","TraesCS6A02G273300","W06","0.827048047520691","4.2221145891942e-05","IPR015418","Eaf6","GO:0000123,GO:0006325,GO:0016573","histone acetyltransferase complex,chromatin organization,histone acetylation","TO_0002637, TO_0002661, TO_0000183","leaf size, seed maturation, other miscellaneous trait","1.086635546","2.961132622","1.38103399","1.152882422","1.310368387","2.38578309"
"TraesCS6A03G0751400.1","TraesCS6A02G282700","W06","0.834198749000871","3.14452808171705e-05","IPR001965, IPR011011, IPR013083, IPR019787","Znf_PHD, Znf_FYVE_PHD, Znf_RING/FYVE/PHD, Znf_PHD-finger","GO:0046872","metal ion binding","TO_0000194, TO_0002759, TO_0020055","globular embryo, grain number, wheat stripe rust disease resistance","0.422647937","1.290671023","0.604446368","0.442456827","0.710106594","1.395652393"
"TraesCS6A03G0756400.1","TraesCS6A02G284600","W06","0.723481449041815","0.00102855642941392","IPR001680, IPR015943, IPR019417, IPR036322","WD40_repeat, WD40/YVTN_repeat-like_dom_sf, DUF2415, WD40_repeat_dom_sf","GO:0005515","protein binding","TO_0000194, TO_0020055","globular embryo, wheat stripe rust disease resistance","0.825487519","1.316549625","1.082862438","0.428900253","0.734997716","1.172958494"
"TraesCS6A03G0774400.1","TraesCS6A02G293900","W06","0.875325916763208","4.20125692702688e-06","IPR005225, IPR006689, IPR027417, IPR044154","Small_GTP-bd_dom, Small_GTPase_ARF/SAR, P-loop_NTPase, Arl8a/8b","GO:0003924,GO:0005525,GO:0015031,GO:0051607","GTPase activity,GTP binding,protein transport,defense response to virus","TO_0000344, TO_0006002, TO_0000183, TO_0000430, TO_0000469, TO_0000396","days to flowering trait, proline content, other miscellaneous trait, germination rate, days to maturity, grain yield trait","6.36975675","19.63392949","3.853033319","3.244242714","4.335233777","6.068656692"
"TraesCS6A03G0777200.1","TraesCS6A02G295000","W06","0.755573553355685","0.000451886698979441","","","GO:0016021","integral component of membrane","TO_0000430, TO_0000043, TO_0000276, TO_0000253, TO_0002661, TO_0000598, TO_0006002, TO_0000190","germination rate, root morphology trait, drought tolerance, seed dormancy, seed maturation, protein content, proline content, seed coat color","0.329105003","10.82819081","0.07531604","0.188067754","0.402511176","0.152547345"
"TraesCS6A03G0804100.1","TraesCS6A02G307400","W06","0.636019144314824","0.00606055079893018","IPR016300, IPR025723, IPR027417","ATPase_ArsA/GET3, Anion-transp_ATPase-like_dom, P-loop_NTPase","GO:0009570,GO:0043529,GO:0005524,GO:0016887,GO:0006620","chloroplast stroma,GET complex,ATP binding,ATP hydrolysis activity,post-translational protein targeting to endoplasmic reticulum membrane","TO_0000495","chlorophyll content","2.906448844","4.097401505","2.541479796","2.523258314","4.148315837","5.560039253"
"TraesCS6A03G0818000.1","TraesCS6A02G313200","W06","0.572077008181744","0.0164143820714943","IPR013094, IPR029058","AB_hydrolase_3, AB_hydrolase","GO:0016787","hydrolase activity","TO_0000524, TO_0000522;TO_0000523, TO_0000495, TO_0000437, TO_0000207, TO_0000004","submergence tolerance, stomatal resistance, chlorophyll content, male sterility, plant height, reversible male sterility","0.090902333","0.969757146","0.138731422","0.080029517","0.32511005","1.452767873"
"TraesCS6A03G0819900.1","TraesCS6A02G314500","W06","0.651468632202898","0.00460946208623878","IPR001623, IPR018253, IPR036869","DnaJ_domain, DnaJ_domain_CS, J_dom_sf","GO:0005634,GO:0005783","nucleus,endoplasmic reticulum","NA","NA","0.828509541","1.46172296","1.225966555","0.75207298","0.982078914","1.750798171"
"TraesCS6A03G0823800.1","TraesCS6A02G316700","W06","0.664823393867011","0.00359450204031224","IPR006766","EXORDIUM-like","GO:0005615","extracellular space","TO_0000437, TO_0000004, TO_0000276, TO_0000430, TO_0000227","male sterility, reversible male sterility, drought tolerance, germination rate, root length","3.58976118","14.08334618","1.778623793","3.582486123","4.502027011","5.718696065"
"TraesCS6A03G0846400.1","TraesCS6A02G327400","W06","0.68105741703018","0.0026132193904099","IPR002885, IPR011990, IPR046848, IPR046960","Pentatricopeptide_repeat, TPR-like_helical_dom_sf, E_motif, PPR_prot_plant","GO:0009507,GO:0003723,GO:0005515,GO:0009451","chloroplast,RNA binding,protein binding,RNA modification","TO_0000580, TO_0000437","cytoplasmic male sterility, male sterility","0.563623545","1.573050676","1.093752395","0.513273787","0.701473431","1.342182223"
"TraesCS6A03G0871000.1","TraesCS6A02G337400","W06","0.784590671202522","0.000191961344054501","IPR025520","DUF4408","NA","NA","TO_0000303","cold tolerance","0.60392631","2.982300976","0.251628947","0.088546131","0.158753609","0.257010658"
"TraesCS6A03G0872300.1","TraesCS6A02G338600","W06","0.610373882358445","0.00926261520037262","IPR004839, IPR005958, IPR015421, IPR015422, IPR015424","Aminotransferase_I/II, TyrNic_aminoTrfase, PyrdxlP-dep_Trfase_major, PyrdxlP-dep_Trfase_small, PyrdxlP-dep_Trfase","GO:0030170,GO:0008483,GO:0006520,GO:0009058","pyridoxal phosphate binding,transaminase activity,cellular amino acid metabolic process,biosynthetic process","TO_0000428, TO_0006017","callus induction, meristem identity","0.423054439","1.908767581","1.491293522","0.568504761","0.967877628","2.226232238"
"TraesCS6A03G0892600.1","TraesCS6A02G346200","W06","0.871300060237924","5.26757918997733e-06","IPR007751, IPR029058, IPR044294","DUF676_lipase-like, AB_hydrolase, Lipase-like","GO:0044255","cellular lipid metabolic process","TO_0006017, TO_0000428","meristem identity, callus induction","1.837986317","3.858498877","1.159939775","0.931108948","1.351675199","2.246710073"
"TraesCS6A03G0898800.1","TraesCS6A02G349500","W06","0.530540370020971","0.0284534446549168","IPR000504, IPR001878, IPR012677, IPR035979, IPR036875","RRM_dom, Znf_CCHC, Nucleotide-bd_a/b_plait_sf, RBD_domain_sf, Znf_CCHC_sf","GO:0008270,GO:0003723,GO:0016607,GO:0016021,GO:0000398","zinc ion binding,RNA binding,nuclear speck,integral component of membrane,mRNA splicing, via spliceosome","TO_0002703, 72, TO_0000183, TO_0000128","protist disease resistance, Grain hardness, other miscellaneous trait, harvest index","4.77093483","7.14523787","3.614479999","3.729584262","6.396490011","10.35272786"
"TraesCS6A03G0899900.1","TraesCS6A02G350200","W06","0.587376146447261","0.0131669620491884","IPR000167","Dehydrin","GO:0009415","response to water","TO_0000303","cold tolerance","0.759763904","14.23198227","0.121464042","1.254141677","2.835130983","1.940292707"
"TraesCS6A03G0909000.1","TraesCS6A02G353600","W06","0.714312407391907","0.00127531226733701","IPR001680, IPR015943, IPR036322","WD40_repeat, WD40/YVTN_repeat-like_dom_sf, WD40_repeat_dom_sf","GO:0005829,GO:0019898,GO:0034045,GO:0005515,GO:0032266,GO:0080025,GO:0000422,GO:0006497,GO:0034497,GO:0044804","cytosol,extrinsic component of membrane,phagophore assembly site membrane,protein binding,phosphatidylinositol-3-phosphate binding,phosphatidylinositol-3,5-bisphosphate binding,autophagy of mitochondrion,protein lipidation,protein localization to phagophore assembly site,autophagy of nucleus","TO_0001013, TO_0000612, TO_0000084","lateral root number, grain density, root number","1.594848768","3.625789218","0.789808757","1.284480344","2.180941315","2.182561819"
"TraesCS6A03G0909400.1","TraesCS6A02G353700","W06","0.791612134648558","0.000153049398463902","IPR013626, IPR017941, IPR036922","PaO, Rieske_2Fe-2S, Rieske_2Fe-2S_sf","GO:0009507,GO:0016021,GO:0010277,GO:0046872,GO:0051537,GO:0045036","chloroplast,integral component of membrane,chlorophyllide a oxygenase [overall] activity,metal ion binding,2 iron, 2 sulfur cluster binding,protein targeting to chloroplast","TO_0000043, TO_0006054","root morphology trait, arsenic concentration","23.67183781","46.39559852","6.342845731","4.154681744","10.63715217","21.7464087"
"TraesCS6A03G0911900.1","TraesCS6A02G355000","W06","0.670459398512","0.00322472303292938","IPR038864","HDR1","GO:0005634,GO:0009909","nucleus,regulation of flower development","TO_0000128, TO_0000112","harvest index, disease resistance","0.524687925","1.558844463","0.26700565","0.422546935","0.56006115","1.025766476"
"TraesCS6A03G0927100.1","TraesCS6A02G362500","W06","0.650385247609795","0.00470102635963846","IPR008709, IPR011989, IPR016024","Neurochondrin, ARM-like, ARM-type_fold","NA","NA","TO_0000344, TO_0000207, TO_0000358, TO_0000469, TO_0000137, TO_0020055","days to flowering trait, plant height, female sterility, days to maturity, days to heading, wheat stripe rust disease resistance","0.308018054","0.928348517","0.371546873","0.458400355","0.474801152","0.588778397"
"TraesCS6A03G0943800.1","TraesCS6A02G372000","W06","0.899534796351191","8.94877843240883e-07","IPR006603, IPR016817","PQ-loop_rpt, MannP-dilichol_defect-1","GO:0016021","integral component of membrane","NA","NA","1.166578811","3.48473598","1.005597827","0.470328705","1.030766037","1.709016414"
"TraesCS6A03G0948700.1","TraesCS6A02G373900","W06","0.904582142342374","6.17183386819563e-07","IPR011032, IPR013149, IPR013154, IPR014189, IPR020843, IPR036291","GroES-like_sf, ADH-like_C, ADH-like_N, Quinone_OxRdtase_PIG3, PKS_ER, NAD(P)-bd_dom_sf","GO:0016491","oxidoreductase activity","NA","NA","13.14407625","44.98972693","6.558116755","5.123918847","10.17537656","14.99423899"
"TraesCS6A03G1000900.1","TraesCS6A02G399000","W06","0.640007033695349","0.00565494537943955","IPR004155, IPR011989, IPR016024, IPR027517","PBS_lyase_HEAT, ARM-like, ARM-type_fold, Deoxyhypusine_hydroxylase","GO:0019135,GO:0046872,GO:0008612","deoxyhypusine monooxygenase activity,metal ion binding,peptidyl-lysine modification to peptidyl-hypusine","NA","NA","2.741575537","5.741487933","4.656499429","3.320280662","4.698739254","6.844313035"
"TraesCS6A03G1001900.1","TraesCS6A02G399600","W06","0.963645900071179","5.28352185951056e-10","IPR001841, IPR013083","Znf_RING, Znf_RING/FYVE/PHD","GO:0004842,GO:0008270,GO:0016567","ubiquitin-protein transferase activity,zinc ion binding,protein ubiquitination","TO_0000043","root morphology trait","4.474943647","9.533724202","3.122415268","2.77931172","5.004026567","8.994416744"
"TraesCS6A03G1006000.1","TraesCS6A02G401500","W06","0.725381190575609","0.000982725396329409","IPR040304","ATG8-IP-1/2","NA","NA","NA","NA","1.674033115","4.240680181","1.288425884","0.814036296","2.490844281","4.679312461"
"TraesCS6A03G1028700.1","TraesCS6A02G412100","W06","0.740883978474023","0.000668002422071047","IPR031468","SMP_LBD","GO:0005783,GO:0016021,GO:0008289,GO:0006869","endoplasmic reticulum,integral component of membrane,lipid binding,lipid transport","TO_0000227","root length","3.500342109","6.748271854","1.43503714","2.106022697","2.689482198","3.607520014"
"TraesCS6A03G1039900.1","TraesCS6A02G416000","W06","0.746562479720568","0.000576081414452785","IPR021420","DUF3067","NA","NA","TO_0000137","days to heading","4.445644335","9.475043334","1.414198789","0.937215446","2.351692868","3.77966549"
"TraesCS6B03G0187500.1","TraesCS6B02G079400","W06","0.802731676315503","0.000105025955089385","IPR000727, IPR045242","T_SNARE_dom, Syntaxin","GO:0012505,GO:0016021,GO:0031201,GO:0000149,GO:0005484,GO:0006886,GO:0006906,GO:0048278","endomembrane system,integral component of membrane,SNARE complex,SNARE binding,SNAP receptor activity,intracellular protein transport,vesicle fusion,vesicle docking","TO_0000183, TO_0020097, TO_0002661, TO_0006001, TO_0000429","other miscellaneous trait, stomatal opening, seed maturation, salt tolerance, salt sensitivity","8.207825381","13.397931","5.758058081","6.525729516","9.906935019","10.95130774"
"TraesCS6B03G0289700.1","TraesCS6B02G117300","W06","0.824404934388385","4.69235637198611e-05","IPR039282","LSU","GO:0098869","cellular oxidant detoxification","TO_0000598","protein content","31.2084611","106.3485723","60.06033336","27.82350473","51.00675141","91.01894367"
"TraesCS6B03G0328100.1","TraesCS6B02G131000","W06","0.713951785264311","0.00128593334909226","","","GO:0005783,GO:0016021,GO:0016192","endoplasmic reticulum,integral component of membrane,vesicle-mediated transport","TO_0000137, TO_0000469, TO_0000344, TO_0020055","days to heading, days to maturity, days to flowering trait, wheat stripe rust disease resistance","0.646246737","1.975612068","1.667020934","0.817354406","0.923972148","1.531463809"
"TraesCS6B03G0347600.1","TraesCS6B02G137600","W06","0.503867318288416","0.0391875124566948","IPR015310, IPR036338","AHSA1-like_N, Aha1","GO:0005829,GO:0001671,GO:0051087,GO:0051879,GO:0006457,GO:0032781","cytosol,ATPase activator activity,chaperone binding,Hsp90 protein binding,protein folding,positive regulation of ATP-dependent activity","TO_0000276","drought tolerance","5.629871403","10.86606929","2.080587481","3.924383147","9.793654908","7.935358763"
"TraesCS6B03G0352500.1","TraesCS6B02G140100","W06","0.560043221756938","0.019385445168296","IPR039175","TIM22","GO:0016021,GO:0042721,GO:0008320,GO:0030943,GO:0045039,GO:0071806","integral component of membrane,TIM22 mitochondrial import inner membrane insertion complex,protein transmembrane transporter activity,mitochondrion targeting sequence binding,protein insertion into mitochondrial inner membrane,protein transmembrane transport","TO_0000207, TO_0000137, TO_0002637, TO_0000344, TO_0020055, TO_0000469","plant height, days to heading, leaf size, days to flowering trait, wheat stripe rust disease resistance, days to maturity","1.439003137","3.109746643","1.388759083","1.230811037","2.011598707","2.79410174"
"TraesCS6B03G0353500.1","TraesCS6B02G140200","W06","0.399821874888179","0.111811910248416","IPR013201, IPR038765","Prot_inhib_I29, Papain-like_cys_pep_sf","NA","NA","NA","NA","6.415359414","11.29237767","10.16212711","5.807773249","9.971810932","15.75494996"
"TraesCS6B03G0406100.1","TraesCS6B02G160800","W06","0.909620560142449","4.1709431732272e-07","IPR002828, IPR030048, IPR036523","SurE-like_Pase/nucleotidase, SurE, SurE-like_sf","GO:0046872,GO:0008252,GO:0016311","metal ion binding,nucleotidase activity,dephosphorylation","NA","NA","3.683618549","6.833159915","3.048843238","2.819661876","5.175973425","6.691477366"
"TraesCS6B03G0417400.1","TraesCS6B02G164200","W06","0.549090139279814","0.0224403368949486","IPR001841, IPR013083","Znf_RING, Znf_RING/FYVE/PHD","GO:0061630,GO:0006511","ubiquitin protein ligase activity,ubiquitin-dependent protein catabolic process","NA","NA","4.731321436","8.558417907","7.024464983","4.109994547","7.390571094","7.588148414"
"TraesCS6B03G0424000.1","TraesCS6B02G167000","W06","0.850026157985215","1.55530478641852e-05","IPR003323, IPR038765","OTU_dom, Papain-like_cys_pep_sf","GO:0016579,GO:0004843,GO:0030968,GO:0005737,GO:0030433","protein deubiquitination,cysteine-type deubiquitinase activity,endoplasmic reticulum unfolded protein response,cytoplasm,ubiquitin-dependent ERAD pathway","NA","NA","1.133414464","2.513509673","1.249561573","0.69982439","1.041191797","1.843333878"
"TraesCS6B03G0426700.1","TraesCS6B02G167800","W06","0.727596397358518","0.000931427749921581","IPR003738, IPR036590","SRAP, SRAP-like","GO:0003697,GO:0008233,GO:0006508,GO:0006974,GO:0018142","single-stranded DNA binding,peptidase activity,proteolysis,cellular response to DNA damage stimulus,protein-DNA covalent cross-linking","TO_0000469, TO_0000128, TO_0000249, TO_0000043","days to maturity, harvest index, leaf senescence trait, root morphology trait","0.096620816","0.314615005","0.102027284","0.052262917","0.124879821","0.104556352"
"TraesCS6B03G0430100.1","TraesCS6B02G168300","W06","0.439563069886891","0.0774843155580583","IPR006936, IPR040222","ALOG_dom, ALOG","GO:0005634,GO:0009299,GO:0009416","nucleus,mRNA transcription,response to light stimulus","TO_0000050, TO_0000276, TO_0000207, TO_0006018, TO_0006019, TO_0000598, TO_0006064","inflorescence branching, drought tolerance, plant height, organ identity, floral organ identity, protein content, rolled leaf","0.846211333","1.24044922","1.205110421","0.799182535","1.222196176","2.195628839"
"TraesCS6B03G0438300.2","TraesCS6B02G171300","W06","0.457299117850089","0.064952675740215","IPR003323, IPR038765","OTU_dom, Papain-like_cys_pep_sf","NA","NA","TO_0000115, TO_0000469, TO_0000344, TO_0020055, TO_0000137","root mass density, days to maturity, days to flowering trait, wheat stripe rust disease resistance, days to heading","0.364986266","0.323910891","0.494921661","0.108730973","0.291101838","0.461892907"
"TraesCS6B03G0447200.1","TraesCS6B02G175200","W06","0.425398020972628","0.0886918834961156","IPR004399, IPR013749, IPR013785, IPR022998, IPR029056, IPR034291, IPR036206","HMP/HMP-P_kinase_dom, PM/HMP-P_kinase-1, Aldolase_TIM, ThiamineP_synth_TenI, Ribokinase-like, TMP_synthase, ThiamineP_synth_sf","GO:0009507,GO:0004789,GO:0005524,GO:0008902,GO:0008972,GO:0046872,GO:0009228,GO:0009229,GO:0016310","chloroplast,thiamine-phosphate diphosphorylase activity,ATP binding,hydroxymethylpyrimidine kinase activity,phosphomethylpyrimidine kinase activity,metal ion binding,thiamine biosynthetic process,thiamine diphosphate biosynthetic process,phosphorylation","NA","NA","5.051106303","6.19397663","3.347149025","4.686230828","6.769112885","6.903596037"
