"ID","Previous_accession","moduleLabels","MM.06","p.MM.06","Interpro.ID","Interpro.Short.Description","GO","GO_term","Ontology.Term","Preferred.Name","SP_d3","SP_d7","R12_d7","R34_d7","R56_d7","R78_d7"
"TraesCS2D03G1068900.1","TraesCS2D02G478400","W06","0.856927691102292","1.11558199134828e-05","IPR013922, IPR036915","Cyclin_PHO80-like, Cyclin-like_sf","GO:0051301,GO:0019901,GO:0000079","cell division,protein kinase binding,regulation of cyclin-dependent protein serine/threonine kinase activity","TO_0000225, TO_0000112, TO_0000043","stamen number, disease resistance, root morphology trait","0.233602094","2.402220587","0.645095728","0.106655561","0.273072622","1.011200228"
"TraesCS2D03G1088200.1","TraesCS2D02G487400","W06","0.701871122182935","0.00168625023474939","IPR005123, IPR027443, IPR044861","Oxoglu/Fe-dep_dioxygenase, IPNS-like_sf, IPNS-like_FE2OG_OXY","GO:0046872,GO:0051213","metal ion binding,dioxygenase activity","TO_0000522;TO_0000523, TO_0000495, TO_0000358, TO_0000303","stomatal resistance, chlorophyll content, female sterility, cold tolerance","0.502603545","1.012566943","0.292091883","0.152008481","0.383747002","0.99953176"
"TraesCS2D03G1092200.1","TraesCS2D02G489100","W06","0.386788797895246","0.125099760010969","IPR009069","Cys_alpha_HP_mot_SF","NA","NA","TO_0000068","lodging incidence","2.068896599","2.860149362","1.694813742","1.815686747","2.181240622","3.295310991"
"TraesCS2D03G1099800.2","TraesCS2D02G493100","W06","0.400694081684642","0.110959803583622","IPR001474, IPR020602, IPR043133, IPR043134","GTP_CycHdrlase_I, GTP_CycHdrlase_I_dom, GTP-CH-I_C/QueF, GTP-CH-I_N","NA","NA","NA","NA","0.03551631","0.374020609","0.122452013","0.058165134","0.135711892","0.159180589"
"TraesCS2D03G1109500.1","TraesCS2D02G497500","W06","0.778268284860381","0.000233779759942427","","","GO:0016021","integral component of membrane","NA","NA","0.878067332","2.363897403","1.019577553","0.497206913","1.357857159","2.311077547"
"TraesCS2D03G1118100.1","TraesCS2D02G502000","W06","0.64273685407016","0.00539013194766334","IPR024738","Hfi1/Tada1","GO:0003713,GO:0045893,GO:0000124,GO:0006357","transcription coactivator activity,positive regulation of DNA-templated transcription,SAGA complex,regulation of transcription by RNA polymerase II","TO_0000183","other miscellaneous trait","0.764987048","1.022875718","0.55405587","0.444314948","0.754833411","1.185444713"
"TraesCS2D03G1146600.1","TraesCS2D02G513600","W06","0.780976155014373","0.000215022355267956","IPR000118, IPR000169, IPR000668, IPR013128, IPR013201, IPR025660, IPR025661, IPR037277, IPR038765, IPR039417","Granulin, Pept_cys_AS, Peptidase_C1A_C, Peptidase_C1A, Prot_inhib_I29, Pept_his_AS, Pept_asp_AS, Granulin_sf, Papain-like_cys_pep_sf, Peptidase_C1A_papain-like","GO:0005615,GO:0004197,GO:0051603,GO:0005764","extracellular space,cysteine-type endopeptidase activity,proteolysis involved in protein catabolic process,lysosome","TO_0000043, TO_0002657, TO_0002637, TO_0000115, TO_0001017, TO_0000576, TO_0000183, TO_0000253, TO_0002661, TO_0006001, TO_0000227, TO_0001018, TO_0020097, TO_0000258, TO_0006047, TO_0000522;TO_0000523, TO_0000605, TO_0000615, TO_0001015, TO_0000479, TO_0000276","root morphology trait, oxidative stress, leaf size, root mass density, water use efficiency, stem length, other miscellaneous trait, seed dormancy, seed maturation, salt tolerance, root length, transpiration rate, stomatal opening, leaf thickness, calcium concentration, stomatal resistance, hydrogen peroxide content, abscisic acid sensitivity, photosynthetic rate, acid sensitivity, drought tolerance","75.13027257","126.0020161","83.66677944","30.82515502","42.92093206","101.0873053"
"TraesCS2D03G1162800.1","TraesCS2D02G521600","W06","0.726564562775105","0.000955039355520765","IPR002699","V_ATPase_D","GO:0005774,GO:0033176,GO:0046961,GO:1902600","vacuolar membrane,proton-transporting V-type ATPase complex,proton-transporting ATPase activity, rotational mechanism,proton transmembrane transport","TO_0000567, TO_0002657","tiller angle, oxidative stress","4.899780007","8.07233975","6.592965781","4.672185537","7.888029796","11.61898841"
"TraesCS2D03G1179500.1","TraesCS2D02G529000","W06","0.706818443435846","0.00151148110709628","IPR004827, IPR025422, IPR046347","bZIP, TGA_domain, bZIP_sf","GO:0003700,GO:0006355,GO:0043565","DNA-binding transcription factor activity,regulation of DNA-templated transcription,sequence-specific DNA binding","TO_0000183, TO_0000207, TO_0002681, TO_0000624, TO_0000173, TO_0006001, TO_0006017, TO_0000241, TO_0006019, TO_0000437, TO_0001051, TO_0000276, TO_0000253, TO_0006036, TO_0006018, TO_0000112, TO_0000259, TO_0002657, TO_0000071, TO_0002692","other miscellaneous trait, plant height, leaf curling, allelopathic effect, ethylene sensitivity, salt tolerance, meristem identity, leaf number, floral organ identity, male sterility, root hair density, drought tolerance, seed dormancy, stem elongation, organ identity, disease resistance, heat tolerance, oxidative stress, anthocyanin content, root meristem development","4.018499935","5.217117004","1.951404019","1.868142834","2.607589707","4.882737282"
"TraesCS2D03G1230500.1","TraesCS2D02G553100","W06","0.417389046763817","0.0955229643028865","IPR002885, IPR011990","Pentatricopeptide_repeat, TPR-like_helical_dom_sf","GO:0005739,GO:0005515","mitochondrion,protein binding","TO_0000194, TO_0000469, TO_0000580, 281, TO_0000249, TO_0000437","globular embryo, days to maturity, cytoplasmic male sterility, Common bunt spike incidence, leaf senescence trait, male sterility","0.626329125","1.301674489","0.365630025","0.730049966","1.015370784","1.052625616"
"TraesCS2D03G1265100.1","TraesCS2D02G600200","W06","0.707274976246168","0.00149613457120668","IPR013010, IPR013083, IPR018121, IPR044286","Znf_SIAH, Znf_RING/FYVE/PHD, 7-in-absentia-prot_TRAF-dom, SINL_plant","GO:0005737,GO:0008270,GO:0016740,GO:0006511,GO:0007275,GO:0016567","cytoplasm,zinc ion binding,transferase activity,ubiquitin-dependent protein catabolic process,multicellular organism development,protein ubiquitination","TO_0000640, TO_0006019, TO_0001007, TO_0002759, TO_0000084, TO_0006018, TO_0000112, TO_0000919, TO_0000227, TO_0000207, TO_0000135","total root number, floral organ identity, coleoptile length, grain number, root number, organ identity, disease resistance, grain weight, root length, plant height, leaf length","1.999256692","4.413453223","3.394487821","2.072855811","2.577893921","4.686192638"
"TraesCS2D03G1342100.1","TraesCS2D02G567100","W06","0.452152077902478","0.0684232411642445","IPR001806, IPR005225, IPR027417","Small_GTPase, Small_GTP-bd_dom, P-loop_NTPase","GO:0005794,GO:0003924,GO:0005525,GO:0006886","Golgi apparatus,GTPase activity,GTP binding,intracellular protein transport","TO_0000183, TO_0000227, TO_0002667, TO_0006001, TO_0000276","other miscellaneous trait, root length, abscisic acid content, salt tolerance, drought tolerance","3.035440505","4.372806567","2.475650383","2.614160288","4.304626885","7.056034921"
"TraesCS3A03G0044200.1","TraesCS3A02G021900","W06","0.865670791717211","7.13917107108313e-06","IPR001128, IPR002401, IPR017972, IPR036396","Cyt_P450, Cyt_P450_E_grp-I, Cyt_P450_CS, Cyt_P450_sf","GO:0016021,GO:0004497,GO:0005506,GO:0016705,GO:0020037","integral component of membrane,monooxygenase activity,iron ion binding,oxidoreductase activity, acting on paired donors, with incorporation or reduction of molecular oxygen,heme binding","TO_0006001, TO_0006017, TO_0000183, TO_0000043, TO_0000428","salt tolerance, meristem identity, other miscellaneous trait, root morphology trait, callus induction","2.381147219","28.43467741","0.209292154","0.116398942","0.482400701","1.182055894"
"TraesCS3A03G0048700.1","TraesCS3A02G024300","W06","0.618412104718239","0.00814045880023497","","","NA","NA","TO_0000310","self-incompatibility","0.178821112","0.819719895","0.1471336","0.063739042","0.189160622","0.512670563"
"TraesCS3A03G0051600.1","TraesCS3A02G025700","W06","0.771644067918116","0.000285509998365645","IPR025714, IPR026635, IPR029063","Methyltranfer_dom, Efm4/METTL10, SAM-dependent_MTases_sf","GO:0005737,GO:0018026,GO:0016279,GO:0018027","cytoplasm,peptidyl-lysine monomethylation,protein-lysine N-methyltransferase activity,peptidyl-lysine dimethylation","TO_0000183","other miscellaneous trait","2.826497157","4.322557505","3.218738503","2.183559979","3.116371436","4.759872567"
"TraesCS3A03G0077500.1","TraesCS3A02G038300","W06","0.784052976821525","0.000195254461675287","IPR002048, IPR011992, IPR018247","EF_hand_dom, EF-hand-dom_pair, EF_Hand_1_Ca_BS","GO:0005509","calcium ion binding","TO_0000276, TO_0000207, TO_0000183, TO_0000227, TO_0000430","drought tolerance, plant height, other miscellaneous trait, root length, germination rate","26.96519069","214.1422209","10.57833237","10.00652275","9.210930039","8.755674499"
"TraesCS3A03G0148300.1","TraesCS3A02G069200","W06","0.345058231864488","0.174957203605821","IPR002182, IPR027417, IPR036388, IPR038005, IPR041118, IPR042197, IPR044974","NB-ARC, P-loop_NTPase, WH-like_DNA-bd_sf, RX-like_CC, Rx_N, Apaf_helical, Disease_R_plants","GO:0043531,GO:0006952","ADP binding,defense response","TO_0000276, TO_0006001","drought tolerance, salt tolerance","1.909539264","3.099276545","1.270095984","2.117230919","3.771130349","3.134211664"
"TraesCS3A03G0193000.1","TraesCS3A02G086900","W06","0.886802759885399","2.10786144956072e-06","IPR000467, IPR000504, IPR003954, IPR012677, IPR034653, IPR035979, IPR040052","G_patch_dom, RRM_dom, RRM_dom_euk, Nucleotide-bd_a/b_plait_sf, SPF45_RRM, RBD_domain_sf, RBM17","GO:0005634,GO:0009507,GO:0045292,GO:0003723,GO:0043484,GO:0006535","nucleus,chloroplast,mRNA cis splicing, via spliceosome,RNA binding,regulation of RNA splicing,cysteine biosynthetic process from serine","TO_0000183, TO_0000479, TO_0000615, TO_0000207, TO_0000043","other miscellaneous trait, acid sensitivity, abscisic acid sensitivity, plant height, root morphology trait","2.324790754","5.642717553","3.115885723","2.09685231","3.619802572","5.426443094"
"TraesCS3A03G0206500.1","TraesCS3A02G093300","W06","0.783406459966786","0.000199276582879838","IPR013087, IPR039258","Znf_C2H2_type, ZNF511","NA","NA","NA","NA","1.875675866","2.690562775","1.694707922","1.312162279","2.043988161","3.268937833"
"TraesCS3A03G0226800.1","TraesCS3A02G103600","W06","0.431965127511745","0.0833593439956013","IPR000999, IPR008226, IPR036389","RNase_III_dom, Mini3_fam, RNase_III_sf","GO:0004525,GO:0006396,GO:0090502","ribonuclease III activity,RNA processing,RNA phosphodiester bond hydrolysis, endonucleolytic","NA","NA","3.284256813","4.725430394","3.892520647","2.988296437","5.266436812","11.71772499"
"TraesCS3A03G0237300.1","TraesCS3A02G108700","W06","0.534906712496406","0.0269376622728787","IPR003819, IPR042098","TauD/TfdA-like, TauD-like_sf","GO:0016491","oxidoreductase activity","NA","NA","2.287655568","5.575519936","6.222870213","1.231234648","5.250155338","10.8020497"
"TraesCS3A03G0239100.4","TraesCS3A02G109900.3","W06","0.577743841522349","0.0151454766716599","","","NA","NA","NA","NA","0.233106343","0.319557735","0.222049678","0.159702794","0.227373509","0.438966116"
"TraesCS3A03G0244400.1","TraesCS3A02G112100","W06","0.7338298918386","0.000798818607971937","IPR024253, IPR036249","Phosducin_thioredoxin-like_dom, Thioredoxin-like_sf","GO:0005737,GO:0006457","cytoplasm,protein folding","NA","NA","2.998129389","7.332053807","3.590526643","2.183062299","5.330817412","10.30588092"
"TraesCS3A03G0245200.1","TraesCS3A02G112600","W06","0.920473635847014","1.65022702194681e-07","IPR000608, IPR016135, IPR023313","UBQ-conjugat_E2, UBQ-conjugating_enzyme/RWD, UBQ-conjugating_AS","GO:0005524,GO:0061631,GO:0000209,GO:0006281,GO:0016574,GO:0043161","ATP binding,ubiquitin conjugating enzyme activity,protein polyubiquitination,DNA repair,histone ubiquitination,proteasome-mediated ubiquitin-dependent protein catabolic process","NA","NA","7.310802332","13.84873346","6.529414756","5.380703571","9.964334471","15.16054329"
"TraesCS3A03G0252400.1","TraesCS3A02G115900","W06","0.822319723042357","5.09385976428323e-05","IPR011009","Kinase-like_dom_sf","GO:0005737,GO:0004103,GO:0004305,GO:0006646,GO:0006657,GO:0016310","cytoplasm,choline kinase activity,ethanolamine kinase activity,phosphatidylethanolamine biosynthetic process,CDP-choline pathway,phosphorylation","TO_0000183","other miscellaneous trait","0.931517172","4.268960458","0.894284225","0.537941318","0.659979901","1.723495108"
"TraesCS3A03G0279900.1","TraesCS3A02G127100","W06","0.889936063909359","1.72384353596213e-06","","","NA","NA","NA","NA","10.82147209","56.82009983","4.809169395","3.3244119","9.550200489","25.78483218"
"TraesCS3A03G0319000.1","TraesCS3A02G132700","W06","0.414040307964405","0.0984880880424189","IPR006917, IPR011256","SOUL_haem-bd, Reg_factor_effector_dom_sf","GO:0110165","cellular anatomical entity","TO_0000137","days to heading","6.547871957","8.577360228","10.09058824","2.590530791","6.099730925","14.09658144"
"TraesCS3A03G0338700.1","TraesCS3A02G146500","W06","0.702117087920395","0.00167718630433005","","","NA","NA","NA","NA","10.84752925","23.03892826","9.552391685","3.646060972","8.053863641","32.13862584"
"TraesCS3A03G0364300.1","TraesCS3A02G156300","W06","0.704797299048838","0.00158098620771636","IPR000608, IPR016135","UBQ-conjugat_E2, UBQ-conjugating_enzyme/RWD","GO:0003676,GO:0061631,GO:0016567","nucleic acid binding,ubiquitin conjugating enzyme activity,protein ubiquitination","TO_0000043, TO_0002657, TO_0006019, TO_0000580, TO_0000437, TO_0000183, TO_0006018","root morphology trait, oxidative stress, floral organ identity, cytoplasmic male sterility, male sterility, other miscellaneous trait, organ identity","2.658437358","4.205219501","1.497317428","2.175893927","3.484740123","4.891196561"
"TraesCS3A03G0371800.1","TraesCS3A02G159400","W06","0.686501454091537","0.00233806480827927","","","NA","NA","NA","NA","0.395434647","1.15690646","0.693255269","0.285252403","0.540097871","1.6323761"
"TraesCS3A03G0374300.1","TraesCS3A02G160300","W06","0.581982795302228","0.0142478281118596","IPR000630, IPR035987","Ribosomal_S8, Ribosomal_S8_sf","GO:0003735,GO:0022627,GO:0006412","structural constituent of ribosome,cytosolic small ribosomal subunit,translation","NA","NA","1.092131672","1.762079302","0.889176217","0.752560949","1.243284888","1.803328813"
"TraesCS3A03G0406300.1","TraesCS3A02G171600","W06","0.641469111329068","0.00551183971198771","IPR000719, IPR001245, IPR008271, IPR011009, IPR017441","Prot_kinase_dom, Ser-Thr/Tyr_kinase_cat_dom, Ser/Thr_kinase_AS, Kinase-like_dom_sf, Protein_kinase_ATP_BS","GO:0005524,GO:0016021,GO:0004674,GO:0006468,GO:0005886","ATP binding,integral component of membrane,protein serine/threonine kinase activity,protein phosphorylation,plasma membrane","TO_0000437, TO_0000040, TO_0000456, TO_0000303, TO_0000207, TO_0000358, TO_0000495, TO_0000522;TO_0000523","male sterility, panicle length, spikelet number, cold tolerance, plant height, female sterility, chlorophyll content, stomatal resistance","1.634445143","2.588863892","0.988777281","1.275821073","2.442856159","3.343079178"
"TraesCS3A03G0409800.1","TraesCS3A02G172900","W06","0.829318366484954","3.8505938038971e-05","IPR005225, IPR006687, IPR006689, IPR027417","Small_GTP-bd_dom, Small_GTPase_SAR1, Small_GTPase_ARF/SAR, P-loop_NTPase","GO:0005525,GO:0003924,GO:0070863,GO:0070971,GO:0005794,GO:0030127,GO:0003400","GTP binding,GTPase activity,positive regulation of protein exit from endoplasmic reticulum,endoplasmic reticulum exit site,Golgi apparatus,COPII vesicle coat,regulation of COPII vesicle coating","NA","NA","3.30143464","6.865288068","2.860206367","2.397639097","4.267836273","6.426136735"
"TraesCS3A03G0426100.1","TraesCS3A02G178900","W06","0.533640648509486","0.0273706032963455","IPR000719, IPR008271, IPR011009, IPR011989, IPR016024, IPR017441, IPR044591","Prot_kinase_dom, Ser/Thr_kinase_AS, Kinase-like_dom_sf, ARM-like, ARM-type_fold, Protein_kinase_ATP_BS, RUK","GO:0005524,GO:0000914,GO:0004672,GO:0110165,GO:0006468,GO:0008017","ATP binding,phragmoplast assembly,protein kinase activity,cellular anatomical entity,protein phosphorylation,microtubule binding","TO_0000194, TO_0000516, TO_0000183, TO_0000469, TO_0000249","globular embryo, relative root length, other miscellaneous trait, days to maturity, leaf senescence trait","0.009996819","0.114999308","0.015681444","0.016091981","0.050497259","0.019738147"
"TraesCS3A03G0443200.1","TraesCS3A02G185300","W06","0.632921841392133","0.00639145905251193","IPR009060, IPR015940, IPR022764, IPR035952","UBA-like_sf, UBA, Peptidase_S54_rhomboid_dom, Rhomboid-like_sf","GO:0016021,GO:0004252,GO:0005515,GO:0006508","integral component of membrane,serine-type endopeptidase activity,protein binding,proteolysis","TO_0000112, TO_0000344, TO_0000259, TO_0000469, TO_0000137, TO_0020055","disease resistance, days to flowering trait, heat tolerance, days to maturity, days to heading, wheat stripe rust disease resistance","1.496162004","2.592216283","0.927484681","1.415266324","1.849735593","1.876742996"
"TraesCS3A03G0444200.1","TraesCS3A02G185800","W06","0.979914613557133","6.46950071334067e-12","IPR000010, IPR018073, IPR027214, IPR046350","Cystatin_dom, Prot_inh_cystat_CS, Cystatin, Cystatin_sf","GO:0004869,GO:0006952,GO:0010951","cysteine-type endopeptidase inhibitor activity,defense response,negative regulation of endopeptidase activity","TO_0000391, TO_0020097, TO_0000207, TO_0000276, TO_0002639, TO_0000181, TO_0006002, TO_0002661, TO_0000567, TO_0000430, TO_0006001","seed size, stomatal opening, plant height, drought tolerance, shoot branching, seed weight, proline content, seed maturation, tiller angle, germination rate, salt tolerance","16.43126507","68.49893369","18.46900435","11.83803138","23.14937016","41.58406953"
"TraesCS3A03G0445900.1","TraesCS3A02G186400","W06","0.756635153562376","0.000438851260685275","IPR005607, IPR035925","BSD_dom, BSD_dom_sf","GO:0005737","cytoplasm","TO_0002637, TO_0000207, TO_0000036, TO_0000183","leaf size, plant height, hybrid incompatibility, other miscellaneous trait","5.050704367","7.954176914","5.161582826","4.029011646","7.437571145","11.28461984"
"TraesCS3A03G0460300.1","TraesCS3A02G191800","W06","0.591324309684409","0.0124176410243177","IPR000717, IPR036390","PCI_dom, WH_DNA-bd_sf","GO:0005737,GO:0008180,GO:0000338","cytoplasm,COP9 signalosome,protein deneddylation","TO_0000344, TO_0000137, TO_0006001, TO_0006038, TO_0020055, TO_0000043, TO_0002661, TO_0000469, TO_0000163, TO_0000253","days to flowering trait, days to heading, salt tolerance, floral organ number, wheat stripe rust disease resistance, root morphology trait, seed maturation, days to maturity, auxin sensitivity, seed dormancy","2.679884567","4.238905273","3.765044254","2.577513377","4.504530355","7.448638461"
"TraesCS3A03G0512900.1","TraesCS3A02G200600","W06","0.832187304891869","3.42095539323596e-05","IPR004827, IPR046347","bZIP, bZIP_sf","GO:0003700,GO:0006355","DNA-binding transcription factor activity,regulation of DNA-templated transcription","TO_0006017, TO_0001018, TO_0000734, TO_0001015, TO_0000397, TO_0000428, TO_0000278, TO_0000181, TO_0000078","meristem identity, transpiration rate, grain length, photosynthetic rate, grain size, callus induction, root to shoot ratio, seed weight, root dry weight","0.85766327","4.100398037","0.755566416","0.677464016","1.153574333","2.620184516"
"TraesCS3A03G0530600.1","TraesCS3A02G204500","W06","0.769206649561784","0.000306803380085814","IPR001096, IPR043577, IPR046427","Peptidase_C13, AE, Legumain_prodom_sf","GO:0006624,GO:0004197,GO:0005773,GO:0051603","vacuolar protein processing,cysteine-type endopeptidase activity,vacuole,proteolysis involved in protein catabolic process","TO_0000183","other miscellaneous trait","2.326892875","3.712569272","2.722604927","1.826848166","2.317787547","4.277108059"
"TraesCS3A03G0558100.1","TraesCS3A02G215100","W06","0.781792421598227","0.000209621721030851","IPR005344","TMEM33/Pom33","GO:0016021","integral component of membrane","TO_0006064, 281","rolled leaf, Common bunt spike incidence","1.230671325","1.983783007","1.226174865","0.98298261","1.270907094","1.865869448"
"TraesCS3A03G0566500.1","TraesCS3A02G218100","W06","0.941948176123187","1.65898097267303e-08","IPR000245, IPR002379, IPR035921","ATPase_proteolipid_csu, ATPase_proteolipid_c-like_dom, F/V-ATP_Csub_sf","GO:1902600,GO:0016021,GO:0033179,GO:0046961","proton transmembrane transport,integral component of membrane,proton-transporting V-type ATPase, V0 domain,proton-transporting ATPase activity, rotational mechanism","TO_0000207, TO_0000227","plant height, root length","3.970232831","14.84326521","4.601686786","3.41079903","4.350730889","7.004843522"
"TraesCS3A03G0583100.1","TraesCS3A02G224500","W06","0.936616895390244","3.15657704813652e-08","IPR010926, IPR011993","Myosin_TH1, PH-like_dom_sf","GO:0016459,GO:0003774,GO:0005524","myosin complex,cytoskeletal motor activity,ATP binding","NA","NA","2.169485397","6.546628991","2.930600941","1.853319959","3.210254441","5.668978655"
"TraesCS3A03G0609700.1","TraesCS3A02G237000","W06","0.800918802149538","0.000111851034602381","","","NA","NA","TO_0000469, TO_0000344, TO_0006002, TO_0000276, TO_0000253, TO_0000190, TO_0000430, TO_0002661","days to maturity, days to flowering trait, proline content, drought tolerance, seed dormancy, seed coat color, germination rate, seed maturation","1.095318483","64.08733425","0.376903444","0.473172107","1.133505545","0.446649993"
"TraesCS3A03G0614100.1","TraesCS3A02G238700","W06","0.760955169180428","0.000388986867887712","IPR002842, IPR038495","ATPase_V1_Esu, ATPase_E_C","GO:0033178,GO:0046961,GO:1902600","proton-transporting two-sector ATPase complex, catalytic domain,proton-transporting ATPase activity, rotational mechanism,proton transmembrane transport","TO_0000183, TO_0006002, TO_0006001, TO_0006054, TO_0002657, TO_0000429","other miscellaneous trait, proline content, salt tolerance, arsenic concentration, oxidative stress, salt sensitivity","10.49265314","14.20158476","8.761112411","7.766090816","15.14829914","21.81987091"
"TraesCS3A03G0618800.1","TraesCS3A02G240500","W06","0.973025348941097","5.79128973733457e-11","IPR002871, IPR011339","NIF_FeS_clus_asmbl_NifU_N, ISCU","GO:0006879,GO:0044571,GO:0008198,GO:0005759,GO:0044572,GO:0051537","cellular iron ion homeostasis,[2Fe-2S] cluster assembly,ferrous iron binding,mitochondrial matrix,[4Fe-4S] cluster assembly,2 iron, 2 sulfur cluster binding","NA","NA","8.680391763","38.34705585","10.50987259","6.176622496","8.88645738","17.10035298"
"TraesCS3A03G0635600.1","TraesCS3A02G246800","W06","0.911657510837328","3.53684698406448e-07","IPR000504, IPR000571, IPR003954, IPR009145, IPR012677, IPR035979","RRM_dom, Znf_CCCH, RRM_dom_euk, U2AF_small, Nucleotide-bd_a/b_plait_sf, RBD_domain_sf","GO:0089701,GO:0030628,GO:0046872,GO:0005681,GO:0000398","U2AF complex,pre-mRNA 3'-splice site binding,metal ion binding,spliceosomal complex,mRNA splicing, via spliceosome","TO_0000919, TO_0020116, TO_0001027, TO_0001018, TO_0000276, TO_0000734, TO_0002657, TO_0000975, TO_0002759, TO_0000696, TO_0000112, TO_0000456, TO_0000495, TO_0020117, TO_0000183, TO_0000043, TO_0000371, TO_0000522;TO_0000523, TO_0000430, TO_0000319, TO_0000207, TO_0000397, TO_0006001, TO_0000598, TO_0012004","grain weight, photochemical quenching, net photosynthetic rate, transpiration rate, drought tolerance, grain length, oxidative stress, grain width, grain number, starch content, disease resistance, spikelet number, chlorophyll content, non photochemical quenching, other miscellaneous trait, root morphology trait, yield trait, stomatal resistance, germination rate, rubisco content, plant height, grain size, salt tolerance, protein content, quantum yield","3.916864409","7.108079533","3.485233341","2.526849881","4.271877828","7.327107192"
"TraesCS3A03G0664500.1","TraesCS3A02G260600","W06","0.886816850952813","2.10598348783792e-06","IPR016969, IPR022742, IPR029058","UCP031088_abhydr, Hydrolase_4, AB_hydrolase","GO:0110165,GO:0004252,GO:0006508","cellular anatomical entity,serine-type endopeptidase activity,proteolysis","TO_0000043, TO_0000115","root morphology trait, root mass density","0.773831895","4.607131586","0.567949506","0.598283843","0.795998999","1.015185728"
"TraesCS3A03G0689700.1","TraesCS3A02G271900","W06","0.754412831316874","0.000466506428767978","IPR003593, IPR003959, IPR027417, IPR041569","AAA+_ATPase, ATPase_AAA_core, P-loop_NTPase, AAA_lid_3","GO:0005524,GO:0016887","ATP binding,ATP hydrolysis activity","TO_0000469, TO_0000344, TO_0000043, TO_0000207, TO_0000137, TO_0000358, TO_0020055","days to maturity, days to flowering trait, root morphology trait, plant height, days to heading, female sterility, wheat stripe rust disease resistance","1.070998857","2.021445405","1.411354663","0.978799093","1.278588186","2.04265533"
"TraesCS3A03G0697200.1","TraesCS3A02G276000","W06","0.431299641692844","0.0838888699275038","IPR031821","SOSSC","GO:0006281,GO:0070876","DNA repair,SOSS complex","NA","NA","0.708052701","1.787284312","2.263421552","0.544425432","1.210563688","2.103984499"
"TraesCS3A03G0713700.1","TraesCS3A02G285600","W06","0.911519033215061","3.57716613081852e-07","IPR000426, IPR001353, IPR023332, IPR029055","Proteasome_asu_N, Proteasome_sua/b, Proteasome_alpha-type, Ntn_hydrolases_N","GO:0005634,GO:0005737,GO:0019773,GO:0010498,GO:0006511,GO:0016787","nucleus,cytoplasm,proteasome core complex, alpha-subunit complex,proteasomal protein catabolic process,ubiquitin-dependent protein catabolic process,hydrolase activity","TO_0020097, TO_0000183, TO_0000303, TO_0000112, 281","stomatal opening, other miscellaneous trait, cold tolerance, disease resistance, Common bunt spike incidence","7.883642462","14.53504544","7.818788368","6.315542379","9.674617124","13.21619762"
