"ID","Previous_accession","moduleLabels","MM.06","p.MM.06","Interpro.ID","Interpro.Short.Description","GO","GO_term","Ontology.Term","Preferred.Name","SP_d3","SP_d7","R12_d7","R34_d7","R56_d7","R78_d7"
"TraesCS4B03G0711200.1","TraesCS4B02G267400","W06","0.741464653532835","0.000658077875203041","IPR001932, IPR036457, IPR039123","PPM-type_phosphatase-like_dom, PPM-type-like_dom_sf, PPTC7","GO:0046872,GO:0006470,GO:0017018","metal ion binding,protein dephosphorylation,myosin phosphatase activity","TO_0000696","starch content","2.474026046","3.848986618","1.865412233","1.280004537","2.414513539","4.027197867"
"TraesCS4B03G0713900.1","TraesCS4B02G268600","W06","0.69469732819507","0.00196885525555294","IPR001806, IPR005225, IPR027417","Small_GTPase, Small_GTP-bd_dom, P-loop_NTPase","GO:0005769,GO:0005829,GO:0010009,GO:0003924,GO:0005525,GO:0006886,GO:0045022","early endosome,cytosol,cytoplasmic side of endosome membrane,GTPase activity,GTP binding,intracellular protein transport,early endosome to late endosome transport","TO_0000043, TO_0006001, TO_0000333, TO_0000696, TO_0000300","root morphology trait, salt tolerance, sugar content, starch content, glucose content","2.864823489","4.511733945","2.541148517","2.600333921","4.203640581","6.289980432"
"TraesCS4B03G0745700.1","TraesCS4B02G281800","W06","0.599143368405139","0.0110334214294899","IPR011990, IPR044961","TPR-like_helical_dom_sf, MS5/SDI1","GO:0005634,GO:0009536,GO:0009579,GO:0005515","nucleus,plastid,thylakoid,protein binding","NA","NA","0.687520282","1.246857578","1.401317234","0.142032274","0.280978257","0.632200167"
"TraesCS4B03G0771800.1","TraesCS4B02G293400","W06","0.546952579378439","0.0230778562680465","IPR001841, IPR013083, IPR022170, IPR044247","Znf_RING, Znf_RING/FYVE/PHD, MUL1-like, SPL2-like","GO:0016021,GO:0004842,GO:0046872,GO:0006996,GO:0016567","integral component of membrane,ubiquitin-protein transferase activity,metal ion binding,organelle organization,protein ubiquitination","TO_0000397, TO_0020055, TO_0000207, TO_0002657, TO_0000112, TO_0000303, TO_0000469","grain size, wheat stripe rust disease resistance, plant height, oxidative stress, disease resistance, cold tolerance, days to maturity","0.626210966","1.061781588","0.724999813","0.601818283","0.913639524","1.339008256"
"TraesCS4B03G0777800.1","TraesCS4B02G295800","W06","0.522064779119777","0.0315825391914634","IPR004837, IPR044880","NaCa_Exmemb, NCX_ion-bd_dom_sf","GO:0098655,GO:0008324,GO:0016021","cation transmembrane transport,cation transmembrane transporter activity,integral component of membrane","TO_0000355","heterosis","6.02326218","10.53760977","6.027595787","8.608644893","10.28998415","13.57767208"
"TraesCS4B03G0787700.1","TraesCS4B02G299700","W06","0.845061227157777","1.95574104054626e-05","IPR001471, IPR016177, IPR036955, IPR044808","AP2/ERF_dom, DNA-bd_dom_sf, AP2/ERF_dom_sf, ERF_plant","GO:0005634,GO:0003677,GO:0003700,GO:0006355,GO:0009873","nucleus,DNA binding,DNA-binding transcription factor activity,regulation of DNA-templated transcription,ethylene-activated signaling pathway","TO_0000612, TO_0000495, TO_0000207, TO_0000019, TO_0002657, TO_0000112, TO_0000696, TO_0000552, TO_0000084, TO_0000325, TO_0006036, TO_0001027, TO_0001017, TO_0000227, TO_0000598, TO_0000434, TO_0006002, TO_0000524, TO_0000522;TO_0000523, TO_0001006, TO_0000607, TO_0000303, TO_0000136, TO_0000276, TO_0000328, TO_0006055, TO_0000919","grain density, chlorophyll content, plant height, seedling height, oxidative stress, disease resistance, starch content, shoot dry weight, root number, soluble protein content, stem elongation, net photosynthetic rate, water use efficiency, root length, protein content, root activity, proline content, submergence tolerance, stomatal resistance, adventitious root number, ash content, cold tolerance, leaf relative water content, drought tolerance, sucrose content, selenium content, grain weight","48.81475552","137.2319252","26.4527902","11.03409687","19.79026782","40.14627256"
"TraesCS4B03G0800000.1","TraesCS4B02G306400","W06","0.94723327783423","8.23487063165338e-09","IPR002067, IPR018108, IPR023395","Mit_carrier, Mitochondrial_sb/sol_carrier, Mt_carrier_dom_sf","GO:0016021,GO:0015711,GO:0015748,GO:0055085,GO:0071705","integral component of membrane,organic anion transport,organophosphate ester transport,transmembrane transport,nitrogen compound transport","TO_0020055, TO_0000137, TO_0000469, TO_0000344","wheat stripe rust disease resistance, days to heading, days to maturity, days to flowering trait","0.941937069","3.098367718","0.827354555","0.718041364","1.297954737","1.71274443"
"TraesCS4B03G0826200.1","TraesCS4B02G318500","W06","0.603623643212694","0.0102973412146843","IPR018276, IPR033575","DDA1_N, DDA1","GO:0032436,GO:0080008","positive regulation of proteasomal ubiquitin-dependent protein catabolic process,Cul4-RING E3 ubiquitin ligase complex","TO_0000190, TO_0006002, TO_0000430, TO_0001017, TO_0020097, TO_0000227, TO_0000303, TO_0000344, TO_0000259, TO_0000071, TO_0000043, TO_0000953, TO_0000183, TO_0000495, TO_0000696, TO_0000253, TO_0002661, TO_0002657, TO_0000276, TO_0000469","seed coat color, proline content, germination rate, water use efficiency, stomatal opening, root length, cold tolerance, days to flowering trait, heat tolerance, anthocyanin content, root morphology trait, stem number, other miscellaneous trait, chlorophyll content, starch content, seed dormancy, seed maturation, oxidative stress, drought tolerance, days to maturity","0.61683038","1.269327504","0.664542877","0.517187213","0.995623772","2.181800687"
"TraesCS4B03G0872000.1","TraesCS4B02G335600","W06","0.902982615269363","6.95810024836391e-07","IPR021788","CPP1-like","GO:0016021","integral component of membrane","TO_0000015","oxygen sensitivity","3.19278127","7.085893362","3.191034289","1.669977269","3.086319305","7.39766172"
"TraesCS4B03G0956000.1","TraesCS4B02G371800","W06","0.561354612841353","0.0190426643480206","IPR012398, IPR013078, IPR029033","PRIB5, His_Pase_superF_clade-1, His_PPase_superfam","GO:0016491,GO:0009644","oxidoreductase activity,response to high light intensity","TO_0000707, TO_0000084, TO_0000276, TO_0006002, TO_0002699, TO_0001013","pericarp color, root number, drought tolerance, proline content, lycopene content, lateral root number","0.70365342","1.808520977","0.34561105","0.304256695","0.215696968","0.565494994"
"TraesCS4B03G0963200.1","TraesCS4B02G375000","W06","0.656085101149864","0.00423531677426328","IPR027417","P-loop_NTPase","NA","NA","TO_0000276, TO_0006002, TO_0020055","drought tolerance, proline content, wheat stripe rust disease resistance","0.590811981","1.301362408","1.048169145","0.744064881","1.13002674","1.815964358"
"TraesCS4B03G0971000.2","TraesCS4B02G379800.2","W06","0.596559835734677","0.0114764965387354","IPR018996, IPR041885, IPR044780","MSC, MAN1_winged_helix_dom, Heh2/Src1","NA","NA","NA","NA","0.183092275","0.489682389","0.152266415","0.134459985","0.343317953","0.757145015"
"TraesCS4B03G0971700.1","TraesCS4B02G380400","W06","0.641610050552199","0.00549820059056465","IPR001763, IPR036873","Rhodanese-like_dom, Rhodanese-like_dom_sf","GO:0005634,GO:0005737,GO:0004725,GO:0008794,GO:0035335","nucleus,cytoplasm,protein tyrosine phosphatase activity,arsenate reductase (glutaredoxin) activity,peptidyl-tyrosine dephosphorylation","TO_0006054, TO_0000495","arsenic concentration, chlorophyll content","1.880827602","3.640054111","2.946541311","1.793295489","2.739322809","4.898533357"
"TraesCS4B03G1005300.1","TraesCS4B02G394700","W06","0.786465600201939","0.000180839817914391","IPR005123, IPR026992, IPR027443, IPR044861","Oxoglu/Fe-dep_dioxygenase, DIOX_N, IPNS-like_sf, IPNS-like_FE2OG_OXY","NA","NA","NA","NA","2.422166365","7.66204499","1.382492163","1.121748691","1.108749051","3.506520163"
"TraesCS4D03G0019200.1","TraesCS4D02G011800","W06","0.920211001374662","1.69022627731737e-07","IPR019358","NEMP_fam","GO:0005637,GO:0016021,GO:0003677,GO:0016491,GO:0022857,GO:0055085","nuclear inner membrane,integral component of membrane,DNA binding,oxidoreductase activity,transmembrane transporter activity,transmembrane transport","TO_0001012, TO_0000115","lateral root length, root mass density","1.216666116","2.529903092","0.789435399","0.791256239","1.178700794","2.183799334"
"TraesCS4D03G0022200.1","TraesCS4D02G013600","W06","0.833446672899787","3.24558445333393e-05","IPR000490, IPR012946, IPR017853, IPR044965","Glyco_hydro_17, X8, Glycoside_hydrolase_SF, Glyco_hydro_17_plant","GO:0005975,GO:0016021,GO:0042973,GO:0046658","carbohydrate metabolic process,integral component of membrane,glucan endo-1,3-beta-D-glucosidase activity,anchored component of plasma membrane","TO_0000183, TO_0000043, TO_0000112","other miscellaneous trait, root morphology trait, disease resistance","2.083373756","12.04884751","2.920195952","1.362091287","2.930652917","3.930951688"
"TraesCS4D03G0031700.1","TraesCS4D02G020200","W06","0.757274611837678","0.000431151505635602","IPR000644, IPR002550, IPR044751, IPR045095, IPR046342","CBS_dom, CNNM, Ion_transp-like_CBS, ACDP, CBS_dom_sf","GO:0016021,GO:0043231,GO:0010960","integral component of membrane,intracellular membrane-bounded organelle,magnesium ion homeostasis","TO_0006002, TO_0000253, TO_0000183, TO_0000276, TO_0000190, TO_0000430, TO_0002661","proline content, seed dormancy, other miscellaneous trait, drought tolerance, seed coat color, germination rate, seed maturation","2.562682772","4.619286596","1.168816565","1.591565114","1.733867528","2.542171763"
"TraesCS4D03G0036500.1","TraesCS4D02G022700","W06","0.784597932134076","0.000191917194776019","IPR000504, IPR012677, IPR035979","RRM_dom, Nucleotide-bd_a/b_plait_sf, RBD_domain_sf","GO:0003723,GO:0005737,GO:0016607,GO:0000398","RNA binding,cytoplasm,nuclear speck,mRNA splicing, via spliceosome","TO_0000344, TO_0000522;TO_0000523, TO_0000137, TO_0000495","days to flowering trait, stomatal resistance, days to heading, chlorophyll content","2.095371366","3.35934703","1.726823336","1.86598312","2.832009132","4.108211466"
"TraesCS4D03G0082700.1","TraesCS4D02G046300","W06","0.817088419563872","6.23069733396427e-05","IPR012955","CASP_C","GO:0030173,GO:0006891","integral component of Golgi membrane,intra-Golgi vesicle-mediated transport","TO_0001013, TO_0000303, TO_0000183, TO_0000084, TO_0020055, TO_0000194","lateral root number, cold tolerance, other miscellaneous trait, root number, wheat stripe rust disease resistance, globular embryo","0.421977849","0.978912636","0.331000424","0.280076137","0.455314434","0.750835156"
"TraesCS4D03G0093600.1","TraesCS4D02G051500","W06","0.645076107509924","0.00517124863854873","IPR000330, IPR014001, IPR027417, IPR038718","SNF2_N, Helicase_ATP-bd, P-loop_NTPase, SNF2-like_sf","GO:0004386,GO:0005524,GO:0140658,GO:0006338","helicase activity,ATP binding,ATP-dependent chromatin remodeler activity,chromatin remodeling","TO_0000469, TO_0000355, TO_0000207, TO_0000344, TO_0000137, TO_0000358, TO_0000183, TO_0000310, TO_0000241, TO_0000492","days to maturity, heterosis, plant height, days to flowering trait, days to heading, female sterility, other miscellaneous trait, self-incompatibility, leaf number, leaf shape","0.04680756","0.579739103","0.10816599","0.083208061","0.199531352","0.183215383"
"TraesCS4D03G0099100.1","TraesCS4D02G054100","W06","0.805699780686345","9.46081806316277e-05","","","NA","NA","TO_0000430, TO_0000344, TO_0000190, TO_0006002, TO_0000253, TO_0000469, TO_0000276, TO_0002661","germination rate, days to flowering trait, seed coat color, proline content, seed dormancy, days to maturity, drought tolerance, seed maturation","0.966445339","29.2633593","0.765691067","0.295542164","0.178845054","0.138489942"
"TraesCS4D03G0111700.1","TraesCS4D02G060000","W06","0.834324402367122","3.12790634922697e-05","IPR005607, IPR035925","BSD_dom, BSD_dom_sf","NA","NA","TO_0000183","other miscellaneous trait","0.764163696","2.812900574","1.098402935","1.000067072","1.373003892","1.979092584"
"TraesCS4D03G0126400.1","TraesCS4D02G067000","W06","0.757823739529636","0.000424629503974619","IPR007062","PPI-2","GO:0004864,GO:0009966,GO:0043086,GO:0043666","protein phosphatase inhibitor activity,regulation of signal transduction,negative regulation of catalytic activity,regulation of phosphoprotein phosphatase activity","NA","NA","4.295255591","5.915617671","2.759925566","2.640757377","4.461123349","5.90192159"
"TraesCS4D03G0130400.1","TraesCS4D02G068900","W06","0.866830883560303","6.71309917245549e-06","IPR002528, IPR045069","MATE_fam, MATE_euk","GO:0042910,GO:1990961,GO:0015297,GO:0016021","xenobiotic transmembrane transporter activity,xenobiotic detoxification by transmembrane export across the plasma membrane,antiporter activity,integral component of membrane","TO_0000112, TO_0000137","disease resistance, days to heading","0.092412876","0.444601033","0.062277647","0.05025224","0.088995205","0.176577931"
"TraesCS4D03G0140900.1","TraesCS4D02G074000","W06","0.876886168161605","3.84065072686661e-06","IPR001680, IPR015943, IPR020472, IPR036322, IPR037867","WD40_repeat, WD40/YVTN_repeat-like_dom_sf, G-protein_beta_WD-40_rep, WD40_repeat_dom_sf, Swd2/WDR82","GO:0005737,GO:0048188,GO:0003682,GO:0005515,GO:0009827,GO:0080182","cytoplasm,Set1C/COMPASS complex,chromatin binding,protein binding,plant-type cell wall modification,histone H3-K4 trimethylation","TO_0020055, TO_0000253, TO_0000430, TO_0006002, TO_0000259, TO_0000495, TO_0000137, TO_0000344, TO_0000227, TO_0002657, TO_0000071, TO_0000183, TO_0000469, TO_0000953","wheat stripe rust disease resistance, seed dormancy, germination rate, proline content, heat tolerance, chlorophyll content, days to heading, days to flowering trait, root length, oxidative stress, anthocyanin content, other miscellaneous trait, days to maturity, stem number","1.242913273","3.956421267","1.265027572","0.945885767","1.622409064","2.156816406"
"TraesCS4D03G0141300.1","TraesCS4D02G074400","W06","0.746289151110789","0.000580251040002809","IPR009914","DPM2","GO:0030176,GO:0033185,GO:0004582,GO:0030234,GO:0006486,GO:0006506,GO:0019348,GO:0050790,GO:0097502","integral component of endoplasmic reticulum membrane,dolichol-phosphate-mannose synthase complex,dolichyl-phosphate beta-D-mannosyltransferase activity,enzyme regulator activity,protein glycosylation,GPI anchor biosynthetic process,dolichol metabolic process,regulation of catalytic activity,mannosylation","TO_0000183","other miscellaneous trait","1.379827921","3.483137969","1.56770599","1.426679884","1.807470379","3.894946975"
"TraesCS4D03G0158100.1","TraesCS4D02G082800","W06","0.598113695775163","0.0112083518417902","","","NA","NA","NA","NA","2.633767726","3.320995229","2.156920909","1.6454573","3.689924578","4.814914093"
"TraesCS4D03G0159400.1","TraesCS4D02G083400","W06","0.51184289423749","0.0357000172147842","IPR045282","At4g08330-like","NA","NA","NA","NA","1.995170357","9.59690776","0.588939728","2.929788749","3.403631255","2.054835643"
"TraesCS4D03G0168200.1","TraesCS4D02G086500","W06","0.511529378213914","0.0358324687714556","","","GO:0016021","integral component of membrane","TO_0000526","sodium concentration","0.549843941","0.683471921","0.466199296","0.427975725","0.62910307","1.017923738"
"TraesCS4D03G0207800.1","TraesCS4D02G105100","W06","0.772314567379273","0.000279874024339162","IPR004827, IPR044759, IPR044797, IPR046347","bZIP, bZIP_RF2, At4g06598-like, bZIP_sf","GO:0003700,GO:0006355","DNA-binding transcription factor activity,regulation of DNA-templated transcription","TO_0000040, TO_0000456, TO_0000137, TO_0000043, TO_0000344, TO_0020055, TO_0000207, TO_0000469, TO_0000183","panicle length, spikelet number, days to heading, root morphology trait, days to flowering trait, wheat stripe rust disease resistance, plant height, days to maturity, other miscellaneous trait","1.782959464","5.373954873","1.941249984","2.470630215","3.215924774","5.782561702"
"TraesCS4D03G0240700.1","TraesCS4D02G120400","W06","0.813760842935348","7.05965150862899e-05","IPR000210, IPR011333, IPR027356, IPR043454","BTB/POZ_dom, SKP1/BTB/POZ_sf, NPH3_dom, NPH3/RPT2-like","GO:0005515,GO:0016567","protein binding,protein ubiquitination","TO_0020097, TO_0000276, TO_0000303, TO_0000112, TO_0000492, TO_0000075, TO_0000541, TO_0006001, TO_0012004, TO_0020116, TO_0000344, TO_0000115, TO_0000522;TO_0000523","stomatal opening, drought tolerance, cold tolerance, disease resistance, leaf shape, light sensitivity, leaf position, salt tolerance, quantum yield, photochemical quenching, days to flowering trait, root mass density, stomatal resistance","0.89754505","3.047048637","0.460706751","0.063520628","0.183593252","0.650482828"
"TraesCS4D03G0246200.1","TraesCS4D02G123100","W06","0.868501077637823","6.13777098838477e-06","IPR004263, IPR040911","Exostosin, Exostosin_GT47","GO:0005794,GO:0016021,GO:0016757,GO:0006486","Golgi apparatus,integral component of membrane,glycosyltransferase activity,protein glycosylation","TO_0000183","other miscellaneous trait","3.878137481","9.832278377","2.451183187","2.565580876","5.059901514","6.909181229"
"TraesCS4D03G0249000.1","TraesCS4D02G124600","W06","0.755325500673178","0.000454978536923582","IPR005500, IPR023203","DUF309, TTHA0068_sf","NA","NA","NA","NA","3.999268432","7.913898374","4.387103083","1.568887153","2.270010689","4.292588917"
"TraesCS4D03G0251100.1","TraesCS4D02G126000","W06","0.572153426190058","0.0163967330191415","IPR001680, IPR015943, IPR022052, IPR036322","WD40_repeat, WD40/YVTN_repeat-like_dom_sf, Histone-bd_RBBP4_N, WD40_repeat_dom_sf","GO:0005515,GO:1900035","protein binding,negative regulation of cellular response to heat","TO_0002639, TO_0000469, TO_0000071, TO_0002657, TO_0000259, 281, TO_0000194, TO_0000953, TO_0000227, TO_0000249, TO_0000495, TO_0000112","shoot branching, days to maturity, anthocyanin content, oxidative stress, heat tolerance, Common bunt spike incidence, globular embryo, stem number, root length, leaf senescence trait, chlorophyll content, disease resistance","4.551894654","4.944252139","2.986236001","3.385301865","4.737843127","6.675974517"
"TraesCS4D03G0316600.1","TraesCS4D02G149400","W06","0.946267428067872","9.40824616761746e-09","IPR003439, IPR003593, IPR017871, IPR027417, IPR032781","ABC_transporter-like_ATP-bd, AAA+_ATPase, ABC_transporter-like_CS, P-loop_NTPase, ABC_tran_Xtn","GO:0005524","ATP binding","TO_0000276, TO_0000358","drought tolerance, female sterility","2.905976588","9.043583775","2.568807424","1.182535733","2.210554349","5.443611536"
"TraesCS4D03G0385700.1","TraesCS4D02G162000","W06","0.809689175363108","8.1986115756004e-05","IPR000889, IPR013766, IPR029759, IPR029760, IPR036249","Glutathione_peroxidase, Thioredoxin_domain, GPX_AS, GPX_CS, Thioredoxin-like_sf","GO:0005829,GO:0004602,GO:0006979,GO:0098869","cytosol,glutathione peroxidase activity,response to oxidative stress,cellular oxidant detoxification","TO_0000421, TO_0000496, TO_0000355, TO_0000199","pollen fertility, carotenoid content, heterosis, genic male sterility","4.450406743","11.33627972","2.51817251","1.824875262","2.703890429","3.022188148"
"TraesCS4D03G0398500.1","TraesCS4D02G164600","W06","0.605249528930418","0.0100400947594418","IPR000620, IPR030184","EamA_dom, WAT1-related","GO:0055085,GO:0022857,GO:0016021,GO:0005886","transmembrane transport,transmembrane transporter activity,integral component of membrane,plasma membrane","TO_0000183, TO_0000043, TO_0006054, TO_0000344, TO_0020055","other miscellaneous trait, root morphology trait, arsenic concentration, days to flowering trait, wheat stripe rust disease resistance","3.979847649","6.317017218","3.863896042","1.841322368","4.199049166","8.919183604"
"TraesCS4D03G0418800.1","TraesCS4D02G168800","W06","0.443791533035099","0.0743485702460732","IPR009518","PSII_PsbX","GO:0009523,GO:0015979","photosystem II,photosynthesis","NA","NA","2.451649302","3.314664783","0.54464633","0.736009869","1.221227863","2.958366933"
"TraesCS4D03G0420900.1","TraesCS4D02G169600","W06","0.702998963860213","0.00164501705399758","IPR011990, IPR019734","TPR-like_helical_dom_sf, TPR_repeat","GO:0043231,GO:0005515","intracellular membrane-bounded organelle,protein binding","TO_0000919, TO_0002699, TO_0000135, TO_0000084, TO_0000207, TO_0001007, TO_0000112, TO_0002759, TO_0000227, TO_0000640, TO_0006002","grain weight, lycopene content, leaf length, root number, plant height, coleoptile length, disease resistance, grain number, root length, total root number, proline content","1.622799203","2.806198402","2.334955085","0.888717436","1.860314422","2.680071524"
"TraesCS4D03G0433500.1","TraesCS4D02G174700","W06","0.376457801209324","0.136387284313765","IPR005995, IPR006124, IPR011258, IPR017850, IPR036646","Pgm_bpd_ind, Metalloenzyme, BPG-indep_PGM_N, Alkaline_phosphatase_core_sf, PGAM_B_sf","GO:0044262,GO:0005737,GO:0006096,GO:0030145,GO:0006007,GO:0046537","cellular carbohydrate metabolic process,cytoplasm,glycolytic process,manganese ion binding,glucose catabolic process,2,3-bisphosphoglycerate-independent phosphoglycerate mutase activity","TO_0000430, TO_0000190, TO_0000276, TO_0006002, TO_0000183, TO_0000344, TO_0000253, TO_0002661, TO_0000696, TO_0000469, TO_0000333","germination rate, seed coat color, drought tolerance, proline content, other miscellaneous trait, days to flowering trait, seed dormancy, seed maturation, starch content, days to maturity, sugar content","0.023490433","0.246055494","0.071443624","0.010025261","0.099446482","0.097064827"
"TraesCS4D03G0433600.1","TraesCS4D02G174800","W06","0.601973793828642","0.0105637110056325","IPR002495, IPR029044, IPR029993","Glyco_trans_8, Nucleotide-diphossugar_trans, GAUT","GO:0047262,GO:0045489,GO:0000139,GO:0071555","polygalacturonate 4-alpha-galacturonosyltransferase activity,pectin biosynthetic process,Golgi membrane,cell wall organization","TO_0000516, TO_0000043, TO_0002657, TO_0000085, TO_0006054, TO_0000993, TO_0000183, TO_0000355","relative root length, root morphology trait, oxidative stress, leaf rolling, arsenic concentration, cellulose content, other miscellaneous trait, heterosis","0.252217625","0.744749865","0.354993497","0.238867037","0.537815514","1.219394533"
"TraesCS4D03G0460100.1","TraesCS4D02G185500","W06","0.752504363099682","0.000491398975016122","IPR004827, IPR045314, IPR046347","bZIP, bZIP_plant_GBF1, bZIP_sf","GO:0005634,GO:0003700,GO:0045893,GO:0000976","nucleus,DNA-binding transcription factor activity,positive regulation of DNA-templated transcription,transcription cis-regulatory region binding","TO_0000004, TO_0000437","reversible male sterility, male sterility","0.26437229","3.536808359","0","0.057963553","0.130018119","0"
"TraesCS4D03G0472500.1","TraesCS4D02G190600","W06","0.954352704887294","2.83541140867893e-09","IPR003593, IPR003959, IPR003960, IPR005937, IPR012340, IPR027417, IPR032501, IPR041569","AAA+_ATPase, ATPase_AAA_core, ATPase_AAA_CS, 26S_Psome_P45-like, NA-bd_OB-fold, P-loop_NTPase, Prot_ATP_ID_OB_C, AAA_lid_3","GO:0016887,GO:0005634,GO:0005524,GO:0043161,GO:0008540,GO:0005737,GO:0008233,GO:1901800,GO:0036402","ATP hydrolysis activity,nucleus,ATP binding,proteasome-mediated ubiquitin-dependent protein catabolic process,proteasome regulatory particle, base subcomplex,cytoplasm,peptidase activity,positive regulation of proteasomal protein catabolic process,proteasome-activating activity","TO_0020095, TO_0000516, TO_0000112, TO_0000495, TO_0002639, TO_0000241, TO_0006046, TO_0000430, TO_0000253, TO_0000731, TO_0002673, TO_0001026, TO_0006001, TO_0000225, TO_0000183, TO_0000303, TO_0000043, TO_0002661, TO_0000173, TO_0001012, TO_0000696, TO_0020097, TO_0020094, TO_0000358, TO_0006060, TO_0000167, TO_0006054, TO_0000071, TO_0000227, TO_0000437, TO_0000115, TO_0002657, TO_0000276, TO_0012004, TO_0000345, TO_0000319, TO_0006014, TO_0006017","stomatal process related trait, relative root length, disease resistance, chlorophyll content, shoot branching, leaf number, sulfur content, germination rate, seed dormancy, lignin content, amino acid content, respiration rate, salt tolerance, stamen number, other miscellaneous trait, cold tolerance, root morphology trait, seed maturation, ethylene sensitivity, lateral root length, starch content, stomatal opening, nitrate content, female sterility, leaf chlorosis, cytokinin sensitivity, arsenic concentration, anthocyanin content, root length, male sterility, root mass density, oxidative stress, drought tolerance, quantum yield, seed viability, rubisco content, phyllotaxy, meristem identity","8.246082047","18.22912002","6.344316162","6.051460061","11.21398621","17.60815549"
"TraesCS4D03G0485000.1","TraesCS4D02G196800","W06","0.734119360297224","0.000793062456154238","IPR020164","Cyt_c_Oxase_assmbl_COX16","GO:0016021,GO:0031966","integral component of membrane,mitochondrial membrane","NA","NA","2.838394394","8.496720484","3.981628293","2.604522425","5.567968431","10.37993561"
"TraesCS4D03G0489600.1","TraesCS4D02G198900","W06","0.788586549495519","0.00016891484227002","","","GO:0016021","integral component of membrane","TO_0002661, TO_0006060","seed maturation, leaf chlorosis","0.517066854","2.79150246","0.318259013","0.274980403","0.265436859","0.554709997"
"TraesCS4D03G0504800.1","TraesCS4D02G206500","W06","0.902528782520571","7.1962048448012e-07","IPR004360, IPR029068, IPR037523","Glyas_Fos-R_dOase_dom, Glyas_Bleomycin-R_OHBP_Dase, VOC","NA","NA","TO_0000190, TO_0002661, TO_0000253, TO_0000276, TO_0000430, TO_0006002","seed coat color, seed maturation, seed dormancy, drought tolerance, germination rate, proline content","0.054208844","19.28704531","0","0","0","0"
"TraesCS4D03G0515400.1","TraesCS4D02G210700","W06","0.926637217966915","9.17699109482971e-08","IPR002347, IPR020904, IPR036291, IPR045000","SDR_fam, Sc_DH/Rdtase_CS, NAD(P)-bd_dom_sf, TR","GO:0016021,GO:0016491","integral component of membrane,oxidoreductase activity","NA","NA","1.87173271","9.494045153","0.700959827","0.614687396","1.535471761","3.750463796"
