"ID","Previous_accession","moduleLabels","MM.16","p.MM.16","Interpro.ID","Interpro.Short.Description","GO","GO_term","Ontology.Term","Preferred.Name","SP_d3","SP_d7","R12_d7","R34_d7","R56_d7","R78_d7"
"TraesCS6A03G0097100.1","TraesCS6A02G042800","W16","0.79821724301885","0.00012271115425057","IPR002885, IPR011990, IPR046848, IPR046960","Pentatricopeptide_repeat, TPR-like_helical_dom_sf, E_motif, PPR_prot_plant","GO:0005515","protein binding","TO_0000580, TO_0000437","cytoplasmic male sterility, male sterility","0.356330298","0.343117503","0","0.275097045","0.327893278","0.502937806"
"TraesCS6A03G0132800.1","TraesCS6A02G059100","W16","0.783310410818289","0.000199880002114886","IPR000727, IPR045242","T_SNARE_dom, Syntaxin","GO:0012505,GO:0016021,GO:0031201,GO:0000149,GO:0005484,GO:0006886,GO:0006906,GO:0048278","endomembrane system,integral component of membrane,SNARE complex,SNARE binding,SNAP receptor activity,intracellular protein transport,vesicle fusion,vesicle docking","TO_0002661, TO_0000183, TO_0020097, TO_0000429, TO_0006001","seed maturation, other miscellaneous trait, stomatal opening, salt sensitivity, salt tolerance","4.837020992","3.248664267","2.191062088","3.893877081","7.242514487","6.355421991"
"TraesCS6A03G0203200.2","TraesCS6A02G089400.2","W16","0.871414525253243","5.23435547147743e-06","IPR000719, IPR002048, IPR008271, IPR011009, IPR011992, IPR017441, IPR018247","Prot_kinase_dom, EF_hand_dom, Ser/Thr_kinase_AS, Kinase-like_dom_sf, EF-hand-dom_pair, Protein_kinase_ATP_BS, EF_Hand_1_Ca_BS","NA","NA","NA","NA","0.298688725","0.360405623","0.042455465","0.566341637","0.900846399","0.192040476"
"TraesCS6A03G0289100.1","TraesCS6A02G122400","W16","0.813068242480724","7.24338111787818e-05","","","NA","NA","TO_0006018, TO_0006019","organ identity, floral organ identity","2.540792902","0.977043324","0.563695689","2.575582613","3.970656069","2.04610126"
"TraesCS6A03G0470800.1","TraesCS6A02G187300","W16","0.917364447260323","2.1800101015725e-07","IPR001926, IPR005856, IPR036052","TrpB-like_PALP, Cys_synth, TrpB-like_PALP_sf","GO:0005737,GO:0004124,GO:0006535","cytoplasm,cysteine synthase activity,cysteine biosynthetic process from serine","TO_0000112, TO_0002758","disease resistance, flag leaf lamina width","0.388138257","0.245059851","0","1.035884726","1.196739676","0.4286242"
"TraesCS6A03G0497500.1","TraesCS6A02G193500","W16","0.655619877437374","0.00427186750670332","IPR001619, IPR027482, IPR036045, IPR043127, IPR043154","Sec1-like, Sec1-like_dom2, Sec1-like_sf, Sec-1-like_dom3a, Sec-1-like_dom1","GO:0019905,GO:0030141,GO:0006904,GO:0006886,GO:0005886","syntaxin binding,secretory granule,vesicle docking involved in exocytosis,intracellular protein transport,plasma membrane","TO_0001017, TO_0000112, TO_0000344, TO_0000701, TO_0000183, TO_0000207, TO_0000137, TO_0000358, TO_0020097, TO_0000469, TO_0000043","water use efficiency, disease resistance, days to flowering trait, turgor pressure, other miscellaneous trait, plant height, days to heading, female sterility, stomatal opening, days to maturity, root morphology trait","0.132232072","0.163026389","0.054314182","0.121458112","0.231557973","0.295991115"
"TraesCS6A03G0535700.1","TraesCS6A02G200500","W16","0.799671406686033","0.000116760526552788","","","NA","NA","NA","NA","0.412357218","0.308278744","0","0.342496585","0.326274555","0.610274061"
"TraesCS6A03G0555800.1","TraesCS6A02G204600","W16","0.704601005226042","0.00158787416503369","IPR000719, IPR001480, IPR008271, IPR011009, IPR017441, IPR024171, IPR036426","Prot_kinase_dom, Bulb-type_lectin_dom, Ser/Thr_kinase_AS, Kinase-like_dom_sf, Protein_kinase_ATP_BS, SRK-like_kinase, Bulb-type_lectin_dom_sf","GO:0005524,GO:0004712,GO:0016021,GO:0004674,GO:0006468,GO:0030246,GO:0106310","ATP binding,protein serine/threonine/tyrosine kinase activity,integral component of membrane,protein serine/threonine kinase activity,protein phosphorylation,carbohydrate binding,protein serine kinase activity","NA","NA","2.930269655","3.571520436","1.401197309","16.46821771","15.33435168","0.776157302"
"TraesCS6A03G0575700.1","TraesCS6A02G209000","W16","0.759997106117075","0.000399616473004615","IPR006813","Glyco_trans_17","GO:0003830,GO:0016021,GO:0006487,GO:0006044","beta-1,4-mannosylglycoprotein 4-beta-N-acetylglucosaminyltransferase activity,integral component of membrane,protein N-linked glycosylation,N-acetylglucosamine metabolic process","TO_0000227, TO_0000183, TO_0000276, TO_0000430","root length, other miscellaneous trait, drought tolerance, germination rate","10.22206531","9.666029313","4.566592065","12.51586504","15.87767788","12.96266734"
"TraesCS6A03G0594800.1","TraesCS6A02G216700","W16","0.730746648355064","0.000862305824745461","","","NA","NA","TO_0020055","wheat stripe rust disease resistance","0.214304115","0.191993498","0","0.139961059","0.241703269","0.403696748"
"TraesCS6A03G0720600.1","TraesCS6A02G269100","W16","0.80622659793274","9.28532052846192e-05","IPR002680, IPR038659","AOX, AOX_sf","GO:0005739,GO:0016021,GO:0070469,GO:0009916,GO:0046872,GO:0102721,GO:0010230","mitochondrion,integral component of membrane,respirasome,alternative oxidase activity,metal ion binding,ubiquinol:oxygen oxidoreductase activity,alternative respiration","TO_0012004, TO_0000495, TO_0006001, TO_0000112, TO_0000303, TO_0002657","quantum yield, chlorophyll content, salt tolerance, disease resistance, cold tolerance, oxidative stress","0.575586371","0.375166395","0.057253648","0.486419698","1.269983471","0.619504097"
"TraesCS6A03G0829200.1","TraesCS6A02G320100","W16","0.802695810173015","0.000105157505098999","IPR004938","XG_FTase","GO:0032580,GO:0036065,GO:0016021,GO:0071555,GO:0008107,GO:0042546","Golgi cisterna membrane,fucosylation,integral component of membrane,cell wall organization,galactoside 2-alpha-L-fucosyltransferase activity,cell wall biogenesis","TO_0000112, TO_0000276, TO_0000227, TO_0000430","disease resistance, drought tolerance, root length, germination rate","0.017789504","0.033014272","0","0.023870739","0.062351897","0.057274586"
"TraesCS6A03G0829300.1","TraesCS6A02G320200","W16","0.808560954772881","8.54025866401349e-05","IPR000823, IPR002016, IPR010255, IPR019793, IPR019794, IPR033905","Peroxidase_pln, Haem_peroxidase, Haem_peroxidase_sf, Peroxidases_heam-ligand_BS, Peroxidases_AS, Secretory_peroxidase","GO:0005576,GO:0004601,GO:0020037,GO:0046872,GO:0006979,GO:0042744,GO:0098869","extracellular region,peroxidase activity,heme binding,metal ion binding,response to oxidative stress,hydrogen peroxide catabolic process,cellular oxidant detoxification","NA","NA","0.900900987","0.706147147","0","0.560557467","0.379166483","0"
"TraesCS6A03G0869200.1","TraesCS6A02G336800","W16","0.84456488080507","2.00018288133999e-05","IPR001412, IPR002300, IPR002301, IPR009008, IPR009080, IPR010663, IPR013155, IPR014729, IPR023585, IPR033708","aa-tRNA-synth_I_CS, aa-tRNA-synth_Ia, Ile-tRNA-ligase, Val/Leu/Ile-tRNA-synth_edit, tRNAsynth_Ia_anticodon-bd, Znf_FPG/IleRS, M/V/L/I-tRNA-synth_anticd-bd, Rossmann-like_a/b/a_fold, Ile-tRNA-ligase_type1, Anticodon_Ile_BEm","GO:0006428,GO:0005524,GO:0004822,GO:0106074,GO:0002161,GO:0000049","isoleucyl-tRNA aminoacylation,ATP binding,isoleucine-tRNA ligase activity,aminoacyl-tRNA metabolism involved in translational fidelity,aminoacyl-tRNA editing activity,tRNA binding","TO_0000128","harvest index","1.76286027","1.771807888","0.541291358","2.948611014","2.412285444","3.156493261"
"TraesCS6A03G0981400.1","TraesCS6A02G390300","W16","0.949333338969853","6.11004701401751e-09","IPR000719, IPR000858, IPR001245, IPR001480, IPR003609, IPR008271, IPR011009, IPR017441, IPR024171, IPR036426","Prot_kinase_dom, S_locus_glycoprot_dom, Ser-Thr/Tyr_kinase_cat_dom, Bulb-type_lectin_dom, Pan_app, Ser/Thr_kinase_AS, Kinase-like_dom_sf, Protein_kinase_ATP_BS, SRK-like_kinase, Bulb-type_lectin_dom_sf","GO:0005524,GO:0004712,GO:0048544,GO:0016021,GO:0004674,GO:0006468,GO:0106310","ATP binding,protein serine/threonine/tyrosine kinase activity,recognition of pollen,integral component of membrane,protein serine/threonine kinase activity,protein phosphorylation,protein serine kinase activity","TO_0000310","self-incompatibility","0.441543129","0.203532279","0","0.475811018","0.61648078","0.133138512"
"TraesCS6A03G0982400.2","TraesCS6A02G390800.2","W16","0.781370940870457","0.000212395989212458","IPR000048, IPR001609, IPR002710, IPR004009, IPR008989, IPR027417, IPR036018, IPR036961, IPR037975","IQ_motif_EF-hand-BS, Myosin_head_motor_dom, Dilute_dom, Myosin_N, Myosin_S1_N, P-loop_NTPase, MYSc_Myo11, Kinesin_motor_dom_sf, MyosinXI_CBD","NA","NA","NA","NA","0.070548277","0.13051657","0","0.054175867","0.051091744","0.083334419"
"TraesCS6A03G1030900.1","TraesCS6A02G413000","W16","0.691264465818582","0.00211719977600343","","","NA","NA","NA","NA","2.559997632","6.491017471","0","1.025774955","1.352982206","2.321523417"
"TraesCS6B03G0041700.1","TraesCS6B02G017800","W16","0.831352299534864","3.54159535371418e-05","","","GO:0005634,GO:0000978,GO:0000981,GO:0046983,GO:0045944","nucleus,RNA polymerase II cis-regulatory region sequence-specific DNA binding,DNA-binding transcription factor activity, RNA polymerase II-specific,protein dimerization activity,positive regulation of transcription by RNA polymerase II","TO_0000183","other miscellaneous trait","41.391948","15.92855291","11.80394197","32.3006762","53.96079929","43.34952165"
"TraesCS6B03G0366400.1","TraesCS6B02G145600","W16","0.817977743484309","6.02360852242359e-05","IPR003439, IPR003593, IPR011527, IPR017871, IPR027417, IPR036640, IPR039421","ABC_transporter-like_ATP-bd, AAA+_ATPase, ABC1_TM_dom, ABC_transporter-like_CS, P-loop_NTPase, ABC1_TM_sf, Type_1_exporter","GO:0016021,GO:0005524,GO:0140359,GO:0055085","integral component of membrane,ATP binding,ABC-type transporter activity,transmembrane transport","TO_0000183, TO_0000043","other miscellaneous trait, root morphology trait","0.057586876","0.023437977","0","0.177859665","0.082208227","0.006727976"
"TraesCS6B03G0366500.1","TraesCS6B02G145700","W16","0.635240388954833","0.00614242304486643","IPR003439, IPR003593, IPR011527, IPR017871, IPR027417, IPR036640, IPR039421","ABC_transporter-like_ATP-bd, AAA+_ATPase, ABC1_TM_dom, ABC_transporter-like_CS, P-loop_NTPase, ABC1_TM_sf, Type_1_exporter","GO:0016021,GO:0005524,GO:0140359,GO:0055085","integral component of membrane,ATP binding,ABC-type transporter activity,transmembrane transport","TO_0002699, TO_0006002","lycopene content, proline content","1.781011946","2.787338001","0.634230806","9.212061195","6.934859488","0.842432558"
"TraesCS6B03G0456700.2","TraesCS6B02G179900.2","W16","0.922986611553005","1.3067400123418e-07","IPR000873, IPR020845, IPR025110, IPR042099, IPR045851","AMP-dep_Synth/Lig_com, AMP-binding_CS, AMP-bd_C, ANL_N_sf, AMP-bd_C_sf","NA","NA","NA","NA","4.750159537","2.421331908","0.53709056","8.905996469","19.14876096","4.589285745"
"TraesCS6B03G0584600.1","TraesCS6B02G217100","W16","0.78162570053032","0.000210715462741003","IPR000719, IPR008271, IPR011009","Prot_kinase_dom, Ser/Thr_kinase_AS, Kinase-like_dom_sf","GO:0005524,GO:0016021,GO:0004674,GO:0006468","ATP binding,integral component of membrane,protein serine/threonine kinase activity,protein phosphorylation","TO_0020098, TO_0000227, TO_0000437","nitrate sensitivity, root length, male sterility","0.786598713","0.979651984","0","1.064688616","0.317296946","0.859627002"
"TraesCS6B03G0636900.1","TraesCS6B02G225800","W16","0.888186240948063","1.93015761734589e-06","IPR000719, IPR001480, IPR008271, IPR011009, IPR017441, IPR024171, IPR036426","Prot_kinase_dom, Bulb-type_lectin_dom, Ser/Thr_kinase_AS, Kinase-like_dom_sf, Protein_kinase_ATP_BS, SRK-like_kinase, Bulb-type_lectin_dom_sf","GO:0005524,GO:0004712,GO:0016021,GO:0004674,GO:0006468,GO:0030246,GO:0106310","ATP binding,protein serine/threonine/tyrosine kinase activity,integral component of membrane,protein serine/threonine kinase activity,protein phosphorylation,carbohydrate binding,protein serine kinase activity","TO_0002699, TO_0006002","lycopene content, proline content","3.497226887","2.155220554","0.583802315","5.611870366","8.812828248","0.905116115"
"TraesCS6B03G0673400.1","TraesCS6B02G234200","W16","0.832984256539955","3.30907225837884e-05","IPR020864, IPR044663","MACPF, CAD1/NSL1-like","GO:2000031,GO:0009626","regulation of salicylic acid mediated signaling pathway,plant-type hypersensitive response","NA","NA","4.576124958","2.959818315","1.200314686","3.343565219","5.465435383","1.772630005"
"TraesCS6B03G0776400.1","TraesCS6B02G265900","W16","0.793997771292919","0.000141438889978165","IPR038824","SHOC1-like","GO:0007131","reciprocal meiotic recombination","NA","NA","0.069750355","0.076751054","0","0.048807353","0.141478014","0.134265538"
"TraesCS6B03G0783600.1","TraesCS6B02G268300","W16","0.9201994474447","1.69200486879159e-07","IPR003613, IPR011989, IPR013083, IPR016024, IPR045185, IPR045210","Ubox_domain, ARM-like, Znf_RING/FYVE/PHD, ARM-type_fold, PUB22/23/24-like, RING-Ubox_PUB","GO:0061630,GO:0016567","ubiquitin protein ligase activity,protein ubiquitination","TO_0000004, TO_0000276, TO_0000183, TO_0000437","reversible male sterility, drought tolerance, other miscellaneous trait, male sterility","1.331749052","0.487346529","0.103678526","1.483625416","2.805879519","0.591728951"
"TraesCS6B03G0786000.1","TraesCS6B02G269500","W16","0.55734750213417","0.0201052018419017","IPR001128, IPR002401, IPR017972, IPR036396","Cyt_P450, Cyt_P450_E_grp-I, Cyt_P450_CS, Cyt_P450_sf","GO:0016021,GO:0004497,GO:0005506,GO:0016705,GO:0020037","integral component of membrane,monooxygenase activity,iron ion binding,oxidoreductase activity, acting on paired donors, with incorporation or reduction of molecular oxygen,heme binding","NA","NA","0","0.089114003","0","0.29366813","0.103246829","0.007492462"
"TraesCS6B03G0863200.1","TraesCS6B02G300500","W16","0.588670783308851","0.0129174194313517","IPR003613, IPR011989, IPR013083, IPR016024, IPR045210","Ubox_domain, ARM-like, Znf_RING/FYVE/PHD, ARM-type_fold, RING-Ubox_PUB","GO:0005634,GO:0005737,GO:0004842,GO:0016567","nucleus,cytoplasm,ubiquitin-protein transferase activity,protein ubiquitination","TO_0000112","disease resistance","4.932526307","8.313341549","3.30759714","10.9108803","9.844668903","8.541142246"
"TraesCS6B03G0910000.1","TraesCS6B02G318500","W16","0.775345450174297","0.000255543003278515","IPR027417, IPR041118","P-loop_NTPase, Rx_N","NA","NA","TO_0000112","disease resistance","0.293659861","0.537542372","0","0.55009315","0.920905908","0.646224182"
"TraesCS6B03G0966500.1","TraesCS6B02G342200","W16","0.832567465930259","3.36719257905275e-05","IPR015425, IPR027643, IPR042201","FH2_Formin, Formin-like_plant, FH2_Formin_sf","GO:0051015,GO:0045010,GO:0016021","actin filament binding,actin nucleation,integral component of membrane","TO_0000624, TO_0002657, TO_0000276, TO_0020097, TO_0000430, TO_0000310, TO_0006047, TO_0000701, TO_0000112, TO_0002682, TO_0006054, TO_0000429","allelopathic effect, oxidative stress, drought tolerance, stomatal opening, germination rate, self-incompatibility, calcium concentration, turgor pressure, disease resistance, plant cell shape, arsenic concentration, salt sensitivity","0.677901588","0.228971912","0.172685881","3.863563735","2.75189487","0.438233425"
"TraesCS6B03G1038900.1","TraesCS6B02G367200","W16","0.755341676095673","0.00045477638423596","IPR001412, IPR002300, IPR002301, IPR009008, IPR009080, IPR013155, IPR014729, IPR023585, IPR033708","aa-tRNA-synth_I_CS, aa-tRNA-synth_Ia, Ile-tRNA-ligase, Val/Leu/Ile-tRNA-synth_edit, tRNAsynth_Ia_anticodon-bd, M/V/L/I-tRNA-synth_anticd-bd, Rossmann-like_a/b/a_fold, Ile-tRNA-ligase_type1, Anticodon_Ile_BEm","GO:0006428,GO:0005524,GO:0004822,GO:0106074,GO:0002161,GO:0000049","isoleucyl-tRNA aminoacylation,ATP binding,isoleucine-tRNA ligase activity,aminoacyl-tRNA metabolism involved in translational fidelity,aminoacyl-tRNA editing activity,tRNA binding","TO_0000734, TO_0000181, TO_0006002, TO_0001015, TO_0001018, TO_0002699, TO_0000078, TO_0000278, TO_0000397","grain length, seed weight, proline content, photosynthetic rate, transpiration rate, lycopene content, root dry weight, root to shoot ratio, grain size","0.780176007","1.052891495","0.319011115","1.699892271","1.054419745","0.903041804"
"TraesCS6B03G1135000.1","TraesCS6B02G401300","W16","0.805558633853767","9.50830907568168e-05","","","NA","NA","TO_0000355, TO_0000207, TO_0000241, TO_0000495, TO_0000050, TO_0000346, TO_0006001, TO_0006017","heterosis, plant height, leaf number, chlorophyll content, inflorescence branching, tiller number, salt tolerance, meristem identity","1.093211822","1.830687152","0","0.593823432","0.79384476","0.284313527"
"TraesCS6B03G1234100.1","TraesCS6B02G442600","W16","0.737665093401259","0.000725296462777369","IPR001611, IPR003591, IPR013210, IPR032675","Leu-rich_rpt, Leu-rich_rpt_typical-subtyp, LRR_N_plant-typ, LRR_dom_sf","GO:0016021,GO:0005515","integral component of membrane,protein binding","NA","NA","0.054464695","0.390695429","0","0.114265618","0.207611613","0.063248887"
"TraesCS6D03G0067800.1","TraesCS6D02G033700","W16","0.9530458836247","3.49057566236153e-09","IPR000719, IPR001245, IPR008271, IPR011009, IPR017441, IPR045874","Prot_kinase_dom, Ser-Thr/Tyr_kinase_cat_dom, Ser/Thr_kinase_AS, Kinase-like_dom_sf, Protein_kinase_ATP_BS, LRK10-like","GO:0005524,GO:0016021,GO:0004674,GO:0006468,GO:0030247","ATP binding,integral component of membrane,protein serine/threonine kinase activity,protein phosphorylation,polysaccharide binding","TO_0000112, TO_0000355, TO_0000598, TO_0000437, TO_0000522;TO_0000523, TO_0000043, TO_0000495, TO_0000136, TO_0000004","disease resistance, heterosis, protein content, male sterility, stomatal resistance, root morphology trait, chlorophyll content, leaf relative water content, reversible male sterility","0.229715214","0.217585723","0","0.310138609","0.438143691","0.223301579"
"TraesCS6D03G0185200.1","TraesCS6D02G083200","W16","0.777036515034226","0.000242754296311487","IPR003953, IPR005288, IPR015939, IPR027477, IPR036188, IPR037099","FAD-binding_2, NadB, Fum_Rdtase/Succ_DH_flav-like_C, Succ_DH/fumarate_Rdtase_cat_sf, FAD/NAD-bd_sf, Fum_R/Succ_DH_flav-like_C_sf","GO:0000166,GO:0044318,GO:0009507,GO:0009435,GO:0008734","nucleotide binding,L-aspartate:fumarate oxidoreductase activity,chloroplast,NAD biosynthetic process,L-aspartate oxidase activity","TO_0002661, TO_0000112, TO_0000276","seed maturation, disease resistance, drought tolerance","2.098975754","1.890603348","0.895815786","2.286203601","4.132126617","1.599489139"
"TraesCS6D03G0222500.1","TraesCS6D02G103200","W16","0.751474604868708","0.000505282701240677","IPR032675","LRR_dom_sf","NA","NA","NA","NA","0.290467394","0.721757017","0","0.216692929","0.137708246","0.01158291"
"TraesCS6D03G0251400.1","TraesCS6D02G115000","W16","0.747502238210468","0.000561934765362511","IPR000719, IPR001611, IPR003591, IPR008271, IPR011009, IPR013210, IPR017441, IPR032675","Prot_kinase_dom, Leu-rich_rpt, Leu-rich_rpt_typical-subtyp, Ser/Thr_kinase_AS, Kinase-like_dom_sf, LRR_N_plant-typ, Protein_kinase_ATP_BS, LRR_dom_sf","GO:0016021,GO:0004672,GO:0005515,GO:0005524,GO:0006468","integral component of membrane,protein kinase activity,protein binding,ATP binding,protein phosphorylation","TO_0000112, TO_0000437","disease resistance, male sterility","0.808103343","0.722125366","0","0.374041061","0.487915385","0.674622775"
"TraesCS6D03G0255600.1","TraesCS6D02G116700","W16","0.772473802528848","0.000278549299119812","IPR001611, IPR003591, IPR013210, IPR032675","Leu-rich_rpt, Leu-rich_rpt_typical-subtyp, LRR_N_plant-typ, LRR_dom_sf","GO:0016021,GO:0004672,GO:0005515,GO:0005524,GO:0006468","integral component of membrane,protein kinase activity,protein binding,ATP binding,protein phosphorylation","TO_0000227, TO_0000276, TO_0006017, TO_0000430, TO_0000428","root length, drought tolerance, meristem identity, germination rate, callus induction","0.187693328","0.270376371","0","0.313328003","0.428153668","0.320710314"
"TraesCS6D03G0324700.2","TraesCS6D02G145600.2","W16","0.891061542903871","1.60134845320337e-06","IPR005045","CDC50/LEM3_fam","NA","NA","NA","NA","0.46851158","0.408901734","0.031718861","0.410756086","0.404300771","0.044020742"
"TraesCS6D03G0325900.1","TraesCS6D02G146500","W16","0.683447334027931","0.00248934410390019","IPR001757, IPR006121, IPR006122, IPR008250, IPR017969, IPR018303, IPR023214, IPR023298, IPR023299, IPR027256, IPR036163, IPR036412, IPR044492","P_typ_ATPase, HMA_dom, HMA_Cu_ion-bd, ATPase_P-typ_transduc_dom_A_sf, Heavy-metal-associated_CS, ATPase_P-typ_P_site, HAD_sf, ATPase_P-typ_TM_dom_sf, ATPase_P-typ_cyto_dom_N, P-typ_ATPase_IB, HMA_dom_sf, HAD-like_sf, P_typ_ATPase_HD_dom","GO:0016887,GO:0005524,GO:0005507,GO:0043682,GO:0016021,GO:0035434,GO:0055070","ATP hydrolysis activity,ATP binding,copper ion binding,P-type divalent copper transporter activity,integral component of membrane,copper ion transmembrane transport,copper ion homeostasis","TO_0000346, TO_0000137, TO_0000303, TO_0006054, TO_0006019, TO_0000183, TO_0000227, TO_0000043","tiller number, days to heading, cold tolerance, arsenic concentration, floral organ identity, other miscellaneous trait, root length, root morphology trait","9.11975596","10.27148684","4.886352556","12.38978007","14.19331089","7.946286907"
"TraesCS6D03G0472300.1","TraesCS6D02G189800","W16","0.876983813896649","3.8189885933621e-06","IPR000719, IPR001480, IPR008271, IPR011009, IPR017441, IPR024171, IPR036426","Prot_kinase_dom, Bulb-type_lectin_dom, Ser/Thr_kinase_AS, Kinase-like_dom_sf, Protein_kinase_ATP_BS, SRK-like_kinase, Bulb-type_lectin_dom_sf","GO:0005524,GO:0004712,GO:0016021,GO:0004674,GO:0006468,GO:0030246,GO:0106310","ATP binding,protein serine/threonine/tyrosine kinase activity,integral component of membrane,protein serine/threonine kinase activity,protein phosphorylation,carbohydrate binding,protein serine kinase activity","NA","NA","0.178900269","0.262274072","0","0.562063183","0.591439469","0.147810262"
"TraesCS6D03G0634700.1","TraesCS6D02G262700","W16","0.715234668705453","0.00124847805285066","IPR002067, IPR002113, IPR018108, IPR023395","Mit_carrier, ADT_euk_type, Mitochondrial_sb/sol_carrier, Mt_carrier_dom_sf","GO:1990544,GO:0005471,GO:0016021,GO:0140021,GO:0005743","mitochondrial ATP transmembrane transport,ATP:ADP antiporter activity,integral component of membrane,mitochondrial ADP transmembrane transport,mitochondrial inner membrane","TO_0006036, TO_0000183, TO_0000495","stem elongation, other miscellaneous trait, chlorophyll content","114.9988551","82.7584456","35.5705873","100.3937551","254.8029675","234.1230937"
"TraesCS6D03G0833900.1","TraesCS6D02G361100","W16","0.74158888801348","0.000655970498206481","IPR000152, IPR000719, IPR000742, IPR001881, IPR008271, IPR011009, IPR017441, IPR018097, IPR025287, IPR045274","EGF-type_Asp/Asn_hydroxyl_site, Prot_kinase_dom, EGF-like_dom, EGF-like_Ca-bd_dom, Ser/Thr_kinase_AS, Kinase-like_dom_sf, Protein_kinase_ATP_BS, EGF_Ca-bd_CS, WAK_GUB, WAK-like","GO:0005524,GO:0005509,GO:0016021,GO:0007166,GO:0004674,GO:0006468,GO:0005886,GO:0030247","ATP binding,calcium ion binding,integral component of membrane,cell surface receptor signaling pathway,protein serine/threonine kinase activity,protein phosphorylation,plasma membrane,polysaccharide binding","NA","NA","0.215431306","0.209943658","0","0.525092464","0.379835283","0"
"TraesCS6D03G0865500.1","TraesCS6D02G375600","W16","0.808203870371423","8.65085533324501e-05","IPR000858, IPR001480, IPR003609, IPR036426","S_locus_glycoprot_dom, Bulb-type_lectin_dom, Pan_app, Bulb-type_lectin_dom_sf","GO:0016021,GO:0004674,GO:0004712,GO:0005524,GO:0106310,GO:0006468,GO:0048544","integral component of membrane,protein serine/threonine kinase activity,protein serine/threonine/tyrosine kinase activity,ATP binding,protein serine kinase activity,protein phosphorylation,recognition of pollen","TO_0000310, TO_0006002, TO_0000276, TO_0000430","self-incompatibility, proline content, drought tolerance, germination rate","0.115709588","0.106749171","0","0.290757936","0.719928611","0.271300932"
"TraesCS6D03G0866100.1","TraesCS6D02G376000","W16","0.88045648516314","3.1133248626412e-06","IPR000858, IPR001480, IPR003609, IPR035446, IPR036426","S_locus_glycoprot_dom, Bulb-type_lectin_dom, Pan_app, SLSG/EP1, Bulb-type_lectin_dom_sf","GO:0016021,GO:0004674,GO:0004712,GO:0005524,GO:0106310,GO:0006468,GO:0048544","integral component of membrane,protein serine/threonine kinase activity,protein serine/threonine/tyrosine kinase activity,ATP binding,protein serine kinase activity,protein phosphorylation,recognition of pollen","TO_0000310","self-incompatibility","0.402837094","0.142856054","0","0.927697197","1.664043245","0.214025152"
"TraesCS6D03G0881700.1","TraesCS6D02G382800","W16","0.739155158529577","0.000698288137819682","IPR001128, IPR002401, IPR017972, IPR036396","Cyt_P450, Cyt_P450_E_grp-I, Cyt_P450_CS, Cyt_P450_sf","GO:0010291,GO:0016705,GO:0005506,GO:0016021,GO:0016123,GO:0020037","carotene beta-ring hydroxylase activity,oxidoreductase activity, acting on paired donors, with incorporation or reduction of molecular oxygen,iron ion binding,integral component of membrane,xanthophyll biosynthetic process,heme binding","TO_0002657, TO_0020116, TO_0000183, TO_0000495, TO_0020117, TO_0000043","oxidative stress, photochemical quenching, other miscellaneous trait, chlorophyll content, non photochemical quenching, root morphology trait","0.058265506","0.077591394","0","0.040861694","0.107747445","0.077519438"
