"ID","Previous_accession","moduleLabels","MM.16","p.MM.16","Interpro.ID","Interpro.Short.Description","GO","GO_term","Ontology.Term","Preferred.Name","SP_d3","SP_d7","R12_d7","R34_d7","R56_d7","R78_d7"
"TraesCS5A03G0532100.1","TraesCS5A02G205000.2","W16","0.905593283390526","5.71509005256908e-07","IPR011990, IPR013766, IPR017937, IPR019734, IPR036249","TPR-like_helical_dom_sf, Thioredoxin_domain, Thioredoxin_CS, TPR_repeat, Thioredoxin-like_sf","GO:0010286,GO:0042802,GO:0000118,GO:0016671,GO:0051085,GO:0051259,GO:0030544","heat acclimation,identical protein binding,histone deacetylase complex,oxidoreductase activity, acting on a sulfur group of donors, disulfide as acceptor,chaperone cofactor-dependent protein refolding,protein complex oligomerization,Hsp70 protein binding","NA","NA","0.120405056","0.099426269","0","0.129494978","0.30028287","0.110408454"
"TraesCS5A03G0592700.1","TraesCS5A02G233200","W16","0.808907688053312","8.43400918879249e-05","IPR003855","K+_transporter","GO:0015079,GO:0071805,GO:0016021","potassium ion transmembrane transporter activity,potassium ion transmembrane transport,integral component of membrane","TO_0000276, TO_0000707","drought tolerance, pericarp color","1.713018946","1.067156804","0.055397954","1.2130705","1.803964975","0.630760412"
"TraesCS5A03G0727300.1","TraesCS5A02G299100","W16","0.85409856377803","1.28097222511695e-05","IPR004263, IPR040911","Exostosin, Exostosin_GT47","GO:0000139,GO:0005743,GO:0016021,GO:0070469,GO:0008121,GO:0016757,GO:0046872,GO:0051537,GO:0006486,GO:0009834,GO:0010417,GO:0022900,GO:0071555,GO:1902600","Golgi membrane,mitochondrial inner membrane,integral component of membrane,respirasome,ubiquinol-cytochrome-c reductase activity,glycosyltransferase activity,metal ion binding,2 iron, 2 sulfur cluster binding,protein glycosylation,plant-type secondary cell wall biogenesis,glucuronoxylan biosynthetic process,electron transport chain,cell wall organization,proton transmembrane transport","TO_0000051","stem strength","0.283940475","0.07750264","0","0.554700498","0.675438844","0.216516075"
"TraesCS5A03G0792300.1","TraesCS5A02G326500","W16","0.768724123743417","0.000311172076269874","IPR001810, IPR013187, IPR017451, IPR036047","F-box_dom, F-box-assoc_dom_typ3, F-box-assoc_interact_dom, F-box-like_dom_sf","GO:0005515","protein binding","TO_0006017, TO_0000580, TO_0000207","meristem identity, cytoplasmic male sterility, plant height","1.140880934","0.221297252","0.347241669","1.47453293","2.096783244","1.40760864"
"TraesCS5A03G0799900.1","TraesCS5A02G330700","W16","0.740448738655246","0.000675522393432951","IPR016037, IPR030960","DHQ_synth_AroB, DHQS/DOIS","GO:0005737,GO:0003856,GO:0009073","cytoplasm,3-dehydroquinate synthase activity,aromatic amino acid family biosynthetic process","TO_0000276","drought tolerance","36.16083104","11.63435176","13.17722079","38.32982897","86.27043358","46.771741"
"TraesCS5A03G0809900.1","TraesCS5A02G336500","W16","0.690247588413009","0.0021628570322956","IPR022043","CAF1A","GO:0005634,GO:0033186,GO:0000724,GO:0006334,GO:0009555,GO:0009825,GO:0009934,GO:0010026,GO:0010448,GO:0010449,GO:0031507,GO:0045787,GO:0048366,GO:0051301","nucleus,CAF-1 complex,double-strand break repair via homologous recombination,nucleosome assembly,pollen development,multidimensional cell growth,regulation of meristem structural organization,trichome differentiation,vegetative meristem growth,root meristem growth,heterochromatin formation,positive regulation of cell cycle,leaf development,cell division","TO_0000344, TO_0002657, TO_0000183, TO_0000043, TO_0000469, 61, TO_0000382, TO_0000137","days to flowering trait, oxidative stress, other miscellaneous trait, root morphology trait, days to maturity, Stem solidness, 1000-grain weight, days to heading","0.164388209","0.1616803","0","0.071845014","0.052747448","0.036322503"
"TraesCS5A03G0858000.1","TraesCS5A02G357000","W16","0.872632194001755","4.89182113458133e-06","IPR000270, IPR011990, IPR019734, IPR044517","PB1_dom, TPR-like_helical_dom_sf, TPR_repeat, PHOX1-4","GO:0005634,GO:0009536,GO:0009579,GO:0005515","nucleus,plastid,thylakoid,protein binding","TO_0006001, TO_0000259, TO_0006017, TO_0000225, TO_0006054, TO_0000112, TO_0000598, TO_0000183","salt tolerance, heat tolerance, meristem identity, stamen number, arsenic concentration, disease resistance, protein content, other miscellaneous trait","5.92546761","6.787872918","1.809547874","5.112803796","9.32584279","6.156240459"
"TraesCS5A03G0864800.1","TraesCS5A02G360200","W16","0.763957881408271","0.000357186021926649","IPR000595, IPR005821, IPR014710, IPR018490","cNMP-bd_dom, Ion_trans_dom, RmlC-like_jellyroll, cNMP-bd_dom_sf","GO:0005216,GO:0034220,GO:0016021","ion channel activity,ion transmembrane transport,integral component of membrane","NA","NA","4.478752262","4.859465238","3.090677319","5.556632772","7.82929931","6.107697803"
"TraesCS5A03G0955400.2","TraesCS5A02G401400.2","W16","0.710083721656835","0.00140451045827498","IPR000719, IPR008271, IPR011009, IPR017441","Prot_kinase_dom, Ser/Thr_kinase_AS, Kinase-like_dom_sf, Protein_kinase_ATP_BS","NA","NA","NA","NA","0.116779396","0.413435377","0.017958794","0.168815392","0.134308382","0.127981563"
"TraesCS5A03G0963300.1","TraesCS5A02G406100","W16","0.828674447437764","3.95304307018849e-05","IPR000719, IPR001220, IPR008271, IPR011009, IPR013320, IPR017441","Prot_kinase_dom, Legume_lectin_dom, Ser/Thr_kinase_AS, Kinase-like_dom_sf, ConA-like_dom_sf, Protein_kinase_ATP_BS","GO:0005524,GO:0002229,GO:0016021,GO:0007178,GO:0006468,GO:0030246,GO:0042742,GO:0005886,GO:0004675","ATP binding,defense response to oomycetes,integral component of membrane,transmembrane receptor protein serine/threonine kinase signaling pathway,protein phosphorylation,carbohydrate binding,defense response to bacterium,plasma membrane,transmembrane receptor protein serine/threonine kinase activity","TO_0000207, TO_0000430, TO_0000276, TO_0000227, TO_0000707","plant height, germination rate, drought tolerance, root length, pericarp color","21.6974231","8.753969556","3.269913948","10.63648","19.67252801","10.5825376"
"TraesCS5B03G0199600.2","TraesCS5B02G080400.2","W16","0.793633544831196","0.000143162120865462","IPR005199, IPR017853","Glyco_hydro_79, Glycoside_hydrolase_SF","NA","NA","NA","NA","0.543237931","0.089295724","0","0.280371539","1.441692192","0.424387152"
"TraesCS5B03G0268300.1","TraesCS5B02G105400","W16","0.83297068117871","3.31095184956753e-05","IPR008144, IPR008145, IPR011043, IPR017665, IPR027417","Guanylate_kin-like_dom, GK/Ca_channel_bsu, Gal_Oxase/kelch_b-propeller, Guanylate_kinase, P-loop_NTPase","GO:0005634,GO:0005524,GO:0046710,GO:0005829,GO:0046037,GO:0004385,GO:0016310","nucleus,ATP binding,GDP metabolic process,cytosol,GMP metabolic process,guanylate kinase activity,phosphorylation","TO_0000004, TO_0000437","reversible male sterility, male sterility","24.61488307","17.52203327","4.521363019","17.8344173","28.71274349","12.7498923"
"TraesCS5B03G0365800.1","TraesCS5B02G132500","W16","0.803229452093364","0.000103214446447572","IPR026961","PGG_dom","GO:0016021","integral component of membrane","TO_0000227, TO_0000430, TO_0000276","root length, germination rate, drought tolerance","0.197811269","0.055723484","0","0.149423653","0.569634558","0.283321335"
"TraesCS5B03G0481100.1","TraesCS5B02G180500","W16","0.73922156247107","0.000697104210613452","IPR004294","Carotenoid_Oase","GO:0009570,GO:0046872,GO:0016121,GO:0010436","chloroplast stroma,metal ion binding,carotene catabolic process,carotenoid dioxygenase activity","TO_0000598, TO_0000004, TO_0000276, TO_0000707, TO_0000437, TO_0000496","protein content, reversible male sterility, drought tolerance, pericarp color, male sterility, carotenoid content","0.109870355","0.302905923","0","0.113931555","0.171905854","0.230335975"
"TraesCS5B03G0517700.1","TraesCS5B02G194400","W16","0.790352301650344","0.000159496543005677","IPR001680, IPR015943, IPR020472, IPR036322","WD40_repeat, WD40/YVTN_repeat-like_dom_sf, G-protein_beta_WD-40_rep, WD40_repeat_dom_sf","GO:0032797,GO:0003723,GO:0005515,GO:0016301,GO:0000387,GO:0016310","SMN complex,RNA binding,protein binding,kinase activity,spliceosomal snRNP assembly,phosphorylation","281","Common bunt spike incidence","6.561997327","6.125650784","2.5259247","5.355671589","8.712452142","8.854839283"
"TraesCS5B03G0695200.1","TraesCS5B02G266600","W16","0.757826547336658","0.000424596367924308","IPR005175, IPR039605","PPC_dom, AHL","GO:0005634,GO:0003680","nucleus,minor groove of adenine-thymine-rich DNA binding","NA","NA","3.495490504","3.463070781","1.210571855","3.241294978","8.786528936","5.792516847"
"TraesCS5B03G0713700.1","TraesCS5B02G274400","W16","0.766458468515534","0.00033238559048687","IPR001313, IPR011989, IPR016024, IPR033133, IPR033712","Pumilio_RNA-bd_rpt, ARM-like, ARM-type_fold, PUM-HD, Pumilio_RNA-bd","GO:0003723,GO:0006417","RNA binding,regulation of translation","NA","NA","0.047679886","0.01311773","0","0.074466696","0.120084102","0.043125219"
"TraesCS5B03G0795300.1","TraesCS5B02G313700","W16","0.822285238342879","5.10073584793791e-05","IPR001810, IPR025886, IPR036047","F-box_dom, PP2-like, F-box-like_dom_sf","GO:0005515","protein binding","TO_0020097, TO_0002681, TO_0006019, TO_0000112, TO_0002657, TO_0000310","stomatal opening, leaf curling, floral organ identity, disease resistance, oxidative stress, self-incompatibility","5.776619009","5.777182996","2.834184654","6.373585038","8.54038825","9.865987207"
"TraesCS5B03G0820300.1","TraesCS5B02G324700","W16","0.884660923874748","2.41046086242734e-06","","","NA","NA","NA","NA","0.564960437","0.256749577","0","0.538583784","0.606934017","0.629075896"
"TraesCS5B03G0837900.1","TraesCS5B02G334300","W16","0.850600761626917","1.51381785540682e-05","IPR000719, IPR001245, IPR001611, IPR003591, IPR008266, IPR011009, IPR017441, IPR032675","Prot_kinase_dom, Ser-Thr/Tyr_kinase_cat_dom, Leu-rich_rpt, Leu-rich_rpt_typical-subtyp, Tyr_kinase_AS, Kinase-like_dom_sf, Protein_kinase_ATP_BS, LRR_dom_sf","GO:0005886,GO:0016021,GO:0004672,GO:0005515,GO:0005524,GO:0006468","plasma membrane,integral component of membrane,protein kinase activity,protein binding,ATP binding,protein phosphorylation","TO_0020055, TO_0000437","wheat stripe rust disease resistance, male sterility","0.304044848","0.058664042","0","1.405378978","1.240908003","0.12735718"
"TraesCS5B03G0953100.1","TraesCS5B02G380600.5","W16","0.641058048481467","0.00555177540049946","IPR005828, IPR020846, IPR036259","MFS_sugar_transport-like, MFS_dom, MFS_trans_sf","GO:0055085,GO:0016021,GO:0015293","transmembrane transport,integral component of membrane,symporter activity","NA","NA","0.088130514","0.165632849","0","0.066735019","0.135219395","0.189055696"
"TraesCS5B03G0979500.1","TraesCS5B02G392900","W16","0.85124723359123","1.46826784131179e-05","IPR000504, IPR012677, IPR035979","RRM_dom, Nucleotide-bd_a/b_plait_sf, RBD_domain_sf","GO:0005634,GO:0003723,GO:0050832","nucleus,RNA binding,defense response to fungus","TO_0006059, TO_0020055, TO_0000469","cadmium concentration, wheat stripe rust disease resistance, days to maturity","4.698292272","4.103734101","0.60049438","2.258254271","4.005606859","1.644104857"
"TraesCS5B03G0984100.1","TraesCS5B02G395700","W16","0.838695272396978","2.59415245857697e-05","IPR001611, IPR032171, IPR032675","Leu-rich_rpt, COR, LRR_dom_sf","GO:0000166,GO:0005515,GO:0009825,GO:0009933,GO:0009956,GO:0009965,GO:0010305,GO:0010540","nucleotide binding,protein binding,multidimensional cell growth,meristem structural organization,radial pattern formation,leaf morphogenesis,leaf vascular tissue pattern formation,basipetal auxin transport","TO_0000115","root mass density","0.218341602","0.283011013","0","0.244328911","0.524301509","0.390784045"
"TraesCS5B03G0995900.1","TraesCS5B02G402000","W16","0.773262963536523","0.000272061079463034","IPR020796, IPR027417, IPR041664, IPR047088","ORC5, P-loop_NTPase, AAA_16, ORC5_C","GO:0003688,GO:0006270,GO:0005664,GO:0009744","DNA replication origin binding,DNA replication initiation,nuclear origin of replication recognition complex,response to sucrose","TO_0006059, TO_0000137","cadmium concentration, days to heading","0.288944103","0.222127699","0.047297593","0.789427348","0.181843802","0.065347407"
"TraesCS5B03G1027300.1","TraesCS5B02G416700","W16","0.876789256029135","3.86225354070765e-06","IPR002020, IPR016142, IPR016143, IPR019810, IPR036969","Citrate_synthase, Citrate_synth-like_lrg_a-sub, Citrate_synth-like_sm_a-sub, Citrate_synthase_AS, Citrate_synthase_sf","GO:0005975,GO:0004108,GO:0005759,GO:0006099","carbohydrate metabolic process,citrate (Si)-synthase activity,mitochondrial matrix,tricarboxylic acid cycle","TO_0006054","arsenic concentration","5.091920025","5.874506068","1.61787153","5.363708101","10.26896856","8.255122938"
"TraesCS5B03G1055300.1","TraesCS5B02G428000","W16","0.844697612117302","1.98821540358295e-05","IPR001305, IPR001623, IPR002939, IPR008971, IPR012724, IPR018253, IPR036410, IPR036869, IPR044713","HSP_DnaJ_Cys-rich_dom, DnaJ_domain, DnaJ_C, HSP40/DnaJ_pept-bd, DnaJ, DnaJ_domain_CS, HSP_DnaJ_Cys-rich_dom_sf, J_dom_sf, DNJA1/2-like","GO:0005524,GO:0009408,GO:0046872,GO:0051087,GO:0005829,GO:0005783,GO:0051082,GO:0042026,GO:0030544","ATP binding,response to heat,metal ion binding,chaperone binding,cytosol,endoplasmic reticulum,unfolded protein binding,protein refolding,Hsp70 protein binding","TO_0000112, TO_0006001, TO_0006019, TO_0006038, TO_0000430, TO_0000735, TO_0000276, TO_0006018, TO_0006002, TO_0006017, TO_0000241, TO_0000344","disease resistance, salt tolerance, floral organ identity, floral organ number, germination rate, plastochron, drought tolerance, organ identity, proline content, meristem identity, leaf number, days to flowering trait","1.777364158","0.988935758","0.076488415","2.034387774","5.395472663","2.574199401"
"TraesCS5B03G1116400.1","TraesCS5B02G455300","W16","0.930193894656043","6.38843305253343e-08","IPR011676","DUF1618","NA","NA","NA","NA","2.373568247","1.328940343","0","2.413344625","2.810124081","2.533906552"
"TraesCS5B03G1172800.1","TraesCS5B02G481000","W16","0.677577154875751","0.0028025685270703","IPR003171, IPR004621, IPR029041","Mehydrof_redctse-like, Fadh2_euk, FAD-linked_oxidoreductase-like","GO:0009086,GO:0071949,GO:0005829,GO:0035999,GO:0106313,GO:0106312","methionine biosynthetic process,FAD binding,cytosol,tetrahydrofolate interconversion,methylenetetrahydrofolate reductase NADPH activity,methylenetetrahydrofolate reductase NADH activity","TO_0000522;TO_0000523, TO_0000183, TO_0000495","stomatal resistance, other miscellaneous trait, chlorophyll content","22.23229516","13.84746842","6.813987752","22.18087897","67.31167996","54.6094717"
"TraesCS5B03G1326000.1","TraesCS5B02G544800","W16","0.617335803295008","0.00828406488984832","IPR000719, IPR001611, IPR003591, IPR008271, IPR011009, IPR013210, IPR017441, IPR032675","Prot_kinase_dom, Leu-rich_rpt, Leu-rich_rpt_typical-subtyp, Ser/Thr_kinase_AS, Kinase-like_dom_sf, LRR_N_plant-typ, Protein_kinase_ATP_BS, LRR_dom_sf","GO:0016021,GO:0004672,GO:0005515,GO:0005524,GO:0006468","integral component of membrane,protein kinase activity,protein binding,ATP binding,protein phosphorylation","TO_0000430, TO_0000707, TO_0000227, TO_0000437, TO_0000276","germination rate, pericarp color, root length, male sterility, drought tolerance","0.1460929","0.024806536","0","0.107387317","0.583468567","0.134574725"
"TraesCS5B03G1341600.1","TraesCS5B02G537300","W16","0.935060750750769","3.76903129018637e-08","IPR013591, IPR027988, IPR044532","Brevis_radix_dom, BRX_N, BRX-like","GO:0005634","nucleus","TO_0000128, TO_0000241, TO_0000207, TO_0006054, TO_0000766, TO_0000115, TO_0000227, TO_0000043, TO_0000206, TO_0000163, TO_0000567, TO_0006046","harvest index, leaf number, plant height, arsenic concentration, petiole length, root mass density, root length, root morphology trait, leaf angle, auxin sensitivity, tiller angle, sulfur content","0.137457809","0.098736445","0","0.236830565","0.241107301","0.068229457"
"TraesCS5D03G0209500.1","TraesCS5D02G086400","W16","0.796586695720577","0.000129684485040297","IPR002182, IPR027417, IPR036388, IPR038005, IPR041118, IPR042197, IPR044974","NB-ARC, P-loop_NTPase, WH-like_DNA-bd_sf, RX-like_CC, Rx_N, Apaf_helical, Disease_R_plants","GO:0043531,GO:0006952","ADP binding,defense response","NA","NA","0.123724305","0.157870472","0.040162525","0.483032459","0.190360996","0.039133224"
"TraesCS5D03G0247800.1","TraesCS5D02G105100","W16","0.828023817206468","4.05888986237279e-05","IPR012416, IPR046829, IPR046830, IPR046831","CBP60, Calmod_bind_C, Calmod_bind_M, Calmodulin_bind_N","GO:0005634,GO:0003700,GO:0005516,GO:0043565,GO:0006355,GO:0080142","nucleus,DNA-binding transcription factor activity,calmodulin binding,sequence-specific DNA binding,regulation of DNA-templated transcription,regulation of salicylic acid biosynthetic process","TO_0002699, TO_0006002","lycopene content, proline content","16.46132019","13.54370558","2.329972071","10.04864486","14.76105412","4.940956489"
"TraesCS5D03G0264200.1","TraesCS5D02G112800","W16","0.879086338632254","3.37715510219349e-06","IPR008144, IPR008145, IPR011043, IPR017665, IPR027417","Guanylate_kin-like_dom, GK/Ca_channel_bsu, Gal_Oxase/kelch_b-propeller, Guanylate_kinase, P-loop_NTPase","GO:0005634,GO:0005524,GO:0046710,GO:0005829,GO:0046037,GO:0004385,GO:0016310","nucleus,ATP binding,GDP metabolic process,cytosol,GMP metabolic process,guanylate kinase activity,phosphorylation","NA","NA","7.511817544","4.906183152","2.162392606","7.731595814","10.421058","4.366517459"
"TraesCS5D03G0320000.1","TraesCS5D02G126700","W16","0.808905382420692","8.43471201127855e-05","IPR001017, IPR029061","DH_E1, THDP-binding","GO:0005947,GO:0016624,GO:0009083","mitochondrial alpha-ketoglutarate dehydrogenase complex,oxidoreductase activity, acting on the aldehyde or oxo group of donors, disulfide as acceptor,branched-chain amino acid catabolic process","TO_0006054, TO_0000183, TO_0000303, TO_0000115","arsenic concentration, other miscellaneous trait, cold tolerance, root mass density","0.095925301","0.128018186","0","0.070565272","0.199986146","0.245851584"
"TraesCS5D03G0409200.1","TraesCS5D02G167800","W16","0.703507398797984","0.00162670176958552","IPR000504, IPR001202, IPR012677, IPR035979, IPR036020","RRM_dom, WW_dom, Nucleotide-bd_a/b_plait_sf, RBD_domain_sf, WW_dom_sf","GO:0003723,GO:0005515","RNA binding,protein binding","TO_0000112, TO_0000241, TO_0000183, TO_0000344, TO_0000276, TO_0002639, TO_0000137, TO_0000071, TO_0002681, TO_0006001, TO_0000227, TO_0002661, TO_0000303, TO_0000619, TO_0000469, TO_0020055, TO_0000253, TO_0000075, TO_0000731, TO_0000194, TO_0006014, TO_0006018, TO_0000430, TO_0000259, TO_0000391, TO_0006036, TO_0006019, TO_0006017, TO_0000271, TO_0002625, TO_0000207","disease resistance, leaf number, other miscellaneous trait, days to flowering trait, drought tolerance, shoot branching, days to heading, anthocyanin content, leaf curling, salt tolerance, root length, seed maturation, cold tolerance, vivipary, days to maturity, wheat stripe rust disease resistance, seed dormancy, light sensitivity, lignin content, globular embryo, phyllotaxy, organ identity, germination rate, heat tolerance, seed size, stem elongation, floral organ identity, meristem identity, inflorescence length, fruit size, plant height","1.900738371","2.422263524","1.151673057","2.253522721","2.582805189","2.473395028"
"TraesCS5D03G0508800.1","TraesCS5D02G216800","W16","0.73474907267302","0.000780659017643027","IPR000719, IPR001245, IPR008271, IPR011009","Prot_kinase_dom, Ser-Thr/Tyr_kinase_cat_dom, Ser/Thr_kinase_AS, Kinase-like_dom_sf","GO:0004672,GO:0005524,GO:0006468","protein kinase activity,ATP binding,protein phosphorylation","TO_0000701, TO_0000227, TO_0020097, TO_0000112, TO_0000514, TO_0000163, TO_0006001, TO_0000207, TO_0000437, TO_0000524, TO_0002657, TO_0000276, TO_0000183","turgor pressure, root length, stomatal opening, disease resistance, potassium uptake, auxin sensitivity, salt tolerance, plant height, male sterility, submergence tolerance, oxidative stress, drought tolerance, other miscellaneous trait","0.071885683","0.169937337","0.070696138","0.187509657","0.625927659","0.019743838"
"TraesCS5D03G0666500.2","TraesCS5D02G292800.2","W16","0.700014987573999","0.00175595483186897","IPR000056, IPR011060, IPR013785, IPR026019","Ribul_P_3_epim-like, RibuloseP-bd_barrel, Aldolase_TIM, Ribul_P_3_epim","NA","NA","NA","NA","0.202316028","0.192088043","0.106601301","0.479497025","1.029628586","0.721103893"
"TraesCS5D03G0667700.2","TraesCS5D02G293700.2","W16","0.819023909159818","5.7874558344797e-05","IPR004843, IPR008963, IPR015914, IPR025733, IPR029052, IPR040974, IPR041792","Calcineurin-like_PHP_ApaH, Purple_acid_Pase-like_N, Purple_acid_Pase_N, Purple_acid_PPase_C_dom, Metallo-depent_PP-like, Fn3_PAP, MPP_PAP","NA","NA","NA","NA","0.182417205","0.057594206","0","0.185479075","0.242635263","0.006957446"
"TraesCS5D03G0709900.1","TraesCS5D02G313912","W16","0.794345949525507","0.000139807893942598","IPR002885, IPR011990, IPR046960","Pentatricopeptide_repeat, TPR-like_helical_dom_sf, PPR_prot_plant","GO:0005515","protein binding","TO_0000580, TO_0000437","cytoplasmic male sterility, male sterility","0.958673911","0.460018469","0","0.857851941","0.359496607","0.62414535"
"TraesCS5D03G0744400.1","TraesCS5D02G330900","W16","0.766070458509599","0.00033613678918082","IPR000152, IPR000719, IPR000742, IPR001881, IPR008271, IPR011009, IPR017441, IPR018097, IPR025287, IPR045274","EGF-type_Asp/Asn_hydroxyl_site, Prot_kinase_dom, EGF-like_dom, EGF-like_Ca-bd_dom, Ser/Thr_kinase_AS, Kinase-like_dom_sf, Protein_kinase_ATP_BS, EGF_Ca-bd_CS, WAK_GUB, WAK-like","GO:0005524,GO:0005509,GO:0016021,GO:0007166,GO:0004674,GO:0006468,GO:0030247","ATP binding,calcium ion binding,integral component of membrane,cell surface receptor signaling pathway,protein serine/threonine kinase activity,protein phosphorylation,polysaccharide binding","TO_0000137","days to heading","0.548515204","0.742851315","0.138909368","2.162943184","2.256106186","0.009365369"
"TraesCS5D03G0749200.1","TraesCS5D02G333600","W16","0.762342970915812","0.000374007925481766","IPR000210, IPR002083, IPR008974, IPR011333, IPR045005","BTB/POZ_dom, MATH/TRAF_dom, TRAF-like, SKP1/BTB/POZ_sf, BPM1-6","GO:0003677,GO:0004519,GO:0005515,GO:0006281,GO:0009628,GO:0016567,GO:0090305","DNA binding,endonuclease activity,protein binding,DNA repair,response to abiotic stimulus,protein ubiquitination,nucleic acid phosphodiester bond hydrolysis","NA","NA","2.806235348","2.073309903","0","1.773129301","1.174730718","1.729532779"
"TraesCS5D03G0829800.1","TraesCS5D02G369800","W16","0.5795581795955","0.0147559754220013","IPR013087, IPR036236, IPR045320","Znf_C2H2_type, Znf_C2H2_sf, JAGGED/SL1-like","GO:0003700","DNA-binding transcription factor activity","TO_0000207, TO_0000580","plant height, cytoplasmic male sterility","1.637766742","0.318219645","0.448186837","1.042390893","0.804491803","1.872487634"
"TraesCS5D03G0889500.1","TraesCS5D02G398800","W16","0.835697010085578","2.95112020705085e-05","IPR000719, IPR001611, IPR003591, IPR008271, IPR011009, IPR013210, IPR017441, IPR032675","Prot_kinase_dom, Leu-rich_rpt, Leu-rich_rpt_typical-subtyp, Ser/Thr_kinase_AS, Kinase-like_dom_sf, LRR_N_plant-typ, Protein_kinase_ATP_BS, LRR_dom_sf","GO:0005524,GO:0005515,GO:0016021,GO:0004674,GO:0006468","ATP binding,protein binding,integral component of membrane,protein serine/threonine kinase activity,protein phosphorylation","TO_0000227, TO_0000430, TO_0000276","root length, germination rate, drought tolerance","1.476653862","0.74935045","0","2.226168191","2.210873567","0.150527304"
"TraesCS5D03G0891400.1","TraesCS5D02G399800","W16","0.671416858514007","0.00316509875610713","IPR001752, IPR019821, IPR027417, IPR036961, IPR044986","Kinesin_motor_dom, Kinesin_motor_CS, P-loop_NTPase, Kinesin_motor_dom_sf, KIF15/KIN-12","GO:0016887,GO:0005524,GO:0003777,GO:1901673,GO:0005819,GO:0005871,GO:0007018,GO:0005641,GO:0005874,GO:0009524,GO:0008017","ATP hydrolysis activity,ATP binding,microtubule motor activity,regulation of mitotic spindle assembly,spindle,kinesin complex,microtubule-based movement,nuclear envelope lumen,microtubule,phragmoplast,microtubule binding","TO_0000137, TO_0000469, TO_0000344","days to heading, days to maturity, days to flowering trait","0.121694536","0.074615537","0","0.032577111","0.064290816","0.089989509"
"TraesCS5D03G0904300.1","TraesCS5D02G407100","W16","0.781554359854677","0.000211184936759531","IPR002921, IPR029058","Fungal_lipase-like, AB_hydrolase","GO:0006629","lipid metabolic process","NA","NA","0.469603364","0.227592544","0","1.238242853","0.923344883","0"
"TraesCS5D03G0991300.1","TraesCS5D02G451600","W16","0.610646940993805","0.00922257512506221","IPR000719, IPR008271, IPR011009, IPR017441","Prot_kinase_dom, Ser/Thr_kinase_AS, Kinase-like_dom_sf, Protein_kinase_ATP_BS","GO:0004672,GO:0005524,GO:0006468","protein kinase activity,ATP binding,protein phosphorylation","NA","NA","0.719801512","0.385472228","0","0.497817112","0.446285499","1.746866264"
"TraesCS5D03G1036800.1","TraesCS5D02G469700","W16","0.928154043224305","7.88126121879362e-08","IPR000719, IPR001480, IPR003609, IPR008271, IPR011009, IPR017441, IPR024171, IPR036426","Prot_kinase_dom, Bulb-type_lectin_dom, Pan_app, Ser/Thr_kinase_AS, Kinase-like_dom_sf, Protein_kinase_ATP_BS, SRK-like_kinase, Bulb-type_lectin_dom_sf","GO:0005524,GO:0016020,GO:0006468,GO:0004674","ATP binding,membrane,protein phosphorylation,protein serine/threonine kinase activity","NA","NA","1.319704775","0.477479619","0.033624587","0.656607763","1.322312484","0.431003158"
"TraesCS5D03G1151900.1","TraesCS5D02G527900","W16","0.611524506209857","0.0090948267845726","IPR002213, IPR035595","UDP_glucos_trans, UDP_glycos_trans_CS","GO:0008194","UDP-glycosyltransferase activity","NA","NA","0.663716379","0.0577897","0.066228352","0.65794438","0.288849177","0.369357053"
