"ID","Previous_accession","moduleLabels","MM.22","p.MM.22","Interpro.ID","Interpro.Short.Description","GO","GO_term","Ontology.Term","Preferred.Name","SP_d3","SP_d7","R12_d7","R34_d7","R56_d7","R78_d7"
"TraesCS6B03G0514200.1","TraesCS6B02G200000","W22","0.947965137627062","7.43182117386828e-09","IPR001544, IPR036038, IPR043131, IPR043132","Aminotrans_IV, Aminotransferase-like, BCAT-like_N, BCAT-like_C","GO:0003824,GO:0019752","catalytic activity,carboxylic acid metabolic process","NA","NA","1.092635142","0.819882554","2.223000969","1.737612768","2.769772954","4.413469289"
"TraesCS6B03G0776900.1","TraesCS6B02G266100","W22","0.629405869293724","0.00678453863472088","IPR000535, IPR008962, IPR013783, IPR016763","MSP_dom, PapD-like_sf, Ig-like_fold, VAP","GO:0000326,GO:0005789,GO:0005886,GO:0016021,GO:0061817,GO:0090158","protein storage vacuole,endoplasmic reticulum membrane,plasma membrane,integral component of membrane,endoplasmic reticulum-plasma membrane tethering,endoplasmic reticulum membrane organization","TO_0000043, TO_0000437, TO_0000183, TO_0000112, TO_0000701","root morphology trait, male sterility, other miscellaneous trait, disease resistance, turgor pressure","1.468387132","1.479905584","1.741842567","1.712900176","2.291843704","3.112230694"
"TraesCS6B03G0907500.1","TraesCS6B02G317200","W22","0.816805520338085","6.29781863509175e-05","IPR005607, IPR035925","BSD_dom, BSD_dom_sf","NA","NA","TO_0000207, TO_0000183","plant height, other miscellaneous trait","2.226821051","3.001184248","3.532264975","2.938234312","4.913939483","7.717147588"
"TraesCS6B03G1214200.1","TraesCS6B02G433800","W22","0.860682953691048","9.24327973551921e-06","IPR001594","Palmitoyltrfase_DHHC","GO:0019706,GO:0018230,GO:0016021,GO:0005794,GO:0005783,GO:0006612","protein-cysteine S-palmitoyltransferase activity,peptidyl-L-cysteine S-palmitoylation,integral component of membrane,Golgi apparatus,endoplasmic reticulum,protein targeting to membrane","TO_0006001","salt tolerance","1.266240746","1.303765285","2.114101884","1.922556618","3.314775194","5.804737727"
"TraesCS6D03G0407900.1","TraesCS6D02G177700","W22","0.870426840397476","5.52699385390446e-06","IPR001487, IPR027353, IPR036427, IPR037377, IPR038336","Bromodomain, NET_dom, Bromodomain-like_sf, GTE_bromo, NET_sf","GO:0005515","protein binding","TO_0000207, TO_0000259, TO_0006064, TO_0000276, TO_0020097, TO_0002673, TO_0020094, TO_0006001, TO_0006002, TO_0000291, TO_0000112, TO_0002637, TO_0000303, TO_0000253, TO_0000202, TO_0000183","plant height, heat tolerance, rolled leaf, drought tolerance, stomatal opening, amino acid content, nitrate content, salt tolerance, proline content, carbohydrate content, disease resistance, leaf size, cold tolerance, seed dormancy, germination ratio, other miscellaneous trait","0.553558647","0.41810425","0.81230518","0.563063365","1.154085691","1.988748031"
"TraesCS6D03G0552300.1","TraesCS6D02G225400","W22","0.69848346850402","0.00181523376562029","IPR006867, IPR006868","DUF632, DUF630","NA","NA","TO_0000492, TO_0000183, TO_0000050, TO_0000085","leaf shape, other miscellaneous trait, inflorescence branching, leaf rolling","0.135944073","0.151305649","0.672621819","0.390079878","1.021577688","0.636500371"
"TraesCS6D03G0752200.1","TraesCS6D02G322300","W22","0.85724025459776","1.09847692796728e-05","IPR002068, IPR008978, IPR031107","A-crystallin/Hsp20_dom, HSP20-like_chaperone, Small_HSP","GO:0043621,GO:0051082,GO:0006457,GO:0009408,GO:0009651,GO:0042542,GO:0051259","protein self-association,unfolded protein binding,protein folding,response to heat,response to salt stress,response to hydrogen peroxide,protein complex oligomerization","TO_0000183, TO_0000430, TO_0000276, TO_0006002","other miscellaneous trait, germination rate, drought tolerance, proline content","0.154996635","0.213295097","1.115133807","0.346634047","0.615897601","1.71490675"
"TraesCS6D03G0842500.1","TraesCS6D02G364500","W22","0.791573610220421","0.000153243253152824","IPR011047, IPR015943, IPR045289","Quinoprotein_ADH-like_supfam, WD40/YVTN_repeat-like_dom_sf, At4g14310-like","GO:0005515","protein binding","NA","NA","0.15866353","0.322566926","0.58606053","0.576712826","0.643981465","1.650136585"
"TraesCS6D03G0872800.1","TraesCS6D02G378100","W22","0.777900472671491","0.000236430039868752","IPR000626, IPR001005, IPR009057, IPR017930, IPR029071, IPR031105","Ubiquitin-like_dom, SANT/Myb, Homeobox-like_sf, Myb_dom, Ubiquitin-like_domsf, TRP_plant","GO:0042803,GO:0042162,GO:0032204","protein homodimerization activity,telomeric DNA binding,regulation of telomere maintenance","TO_0000344, TO_0002657, TO_0000183, TO_0000136, TO_0000043, TO_0000437, TO_0000522;TO_0000523, TO_0000303, TO_0000253, TO_0000495, TO_0006004, TO_0006001, TO_0000598, TO_0000259, TO_0000137","days to flowering trait, oxidative stress, other miscellaneous trait, leaf relative water content, root morphology trait, male sterility, stomatal resistance, cold tolerance, seed dormancy, chlorophyll content, raffinose content, salt tolerance, protein content, heat tolerance, days to heading","0.231683469","0.340571542","0.991001786","0.952977477","0.981584392","1.943768109"
"TraesCS6D03G0876400.2","TraesCS6D02G379900.2.mrna1","W22","0.789281007623186","0.000165156567791083","IPR027417","P-loop_NTPase","NA","NA","NA","NA","0","0.045892012","0.142279062","0.093619433","0.200585787","0.161717729"
"TraesCS7A03G0410400.1","TraesCS7A02G174500","W22","0.882353245317794","2.77721903308205e-06","IPR001155, IPR013785, IPR045247","OxRdtase_FMN_N, Aldolase_TIM, Oye-like","GO:0010181,GO:0016491,GO:0006633,GO:0031408","FMN binding,oxidoreductase activity,fatty acid biosynthetic process,oxylipin biosynthetic process","TO_0000355","heterosis","2.419261596","5.212805442","18.19771674","8.692231352","10.34321816","21.04580255"
"TraesCS7A03G0512800.1","TraesCS7A02G220100","W22","0.911029201789334","3.72296142757828e-07","IPR001810, IPR036047","F-box_dom, F-box-like_dom_sf","GO:0005515","protein binding","TO_0000112, TO_0000640, TO_0000919, TO_0002759, TO_0000227, TO_0000084, TO_0000207, TO_0000135, TO_0001007","disease resistance, total root number, grain weight, grain number, root length, root number, plant height, leaf length, coleoptile length","1.257460744","0.583554425","3.511794052","2.389218927","2.565056927","7.823105366"
"TraesCS7A03G0567900.1","TraesCS7A02G246900","W22","0.723379459208","0.00103106598893733","IPR002347, IPR020904, IPR036291","SDR_fam, Sc_DH/Rdtase_CS, NAD(P)-bd_dom_sf","GO:0016491","oxidoreductase activity","TO_0000043","root morphology trait","1.188472649","1.500290626","1.918483509","2.296577755","3.622574716","4.563976336"
"TraesCS7A03G0957000.1","TraesCS7A02G395500","W22","0.890948459587262","1.61331026699759e-06","IPR001810, IPR036047","F-box_dom, F-box-like_dom_sf","GO:0005515","protein binding","NA","NA","0.063245365","0.037209654","0.244524327","0.22057616","0.352250452","0.705557926"
"TraesCS7A03G0958300.1","TraesCS7A02G396100","W22","0.830287903255859","3.70057450487445e-05","IPR001509, IPR036291","Epimerase_deHydtase, NAD(P)-bd_dom_sf","GO:0003824","catalytic activity","TO_0002657, TO_0000276, TO_0000707, TO_0001013, TO_0000428, TO_0000084, TO_0000112, TO_0006002, TO_0002699","oxidative stress, drought tolerance, pericarp color, lateral root number, callus induction, root number, disease resistance, proline content, lycopene content","0.08536377","0.036208298","0.431305979","0.206464142","0.206065739","0.602747791"
"TraesCS7A03G0963800.1","TraesCS7A02G397900","W22","0.698005770681099","0.00183405578820843","","","GO:0005762","mitochondrial large ribosomal subunit","TO_0000567, TO_0006036, TO_0000112, TO_0000128","tiller angle, stem elongation, disease resistance, harvest index","0.295994815","0.280515577","0.667700806","0.286453389","0.627571328","0.768243728"
"TraesCS7B03G0213400.1","TraesCS7B02G079300","W22","0.757076986149765","0.000433519022902621","IPR001155, IPR013785, IPR045247","OxRdtase_FMN_N, Aldolase_TIM, Oye-like","GO:0010181,GO:0016491,GO:0006633,GO:0031408","FMN binding,oxidoreductase activity,fatty acid biosynthetic process,oxylipin biosynthetic process","TO_0000004, TO_0000437","reversible male sterility, male sterility","0.073982459","0.542109896","1.382563114","0.556412468","0.911095486","1.406101591"
"TraesCS7B03G0365800.1","TraesCS7B02G134600","W22","0.772360823148756","0.000279488667448823","IPR008811, IPR013785, IPR017853","Glycosyl_hydrolases_36, Aldolase_TIM, Glycoside_hydrolase_SF","GO:0016757,GO:0005975","glycosyltransferase activity,carbohydrate metabolic process","TO_0002699, TO_0006002, TO_0000085, TO_0002657, TO_0002759, TO_0000207, TO_0006001","lycopene content, proline content, leaf rolling, oxidative stress, grain number, plant height, salt tolerance","0.008033682","0.046282783","0.210053093","0.048342184","0.13496596","0.433675207"
"TraesCS7B03G0420800.1","TraesCS7B02G154700","W22","0.755318785071745","0.000455062487260691","IPR001394, IPR013083, IPR018200, IPR028889, IPR038765","Peptidase_C19_UCH, Znf_RING/FYVE/PHD, USP_CS, USP_dom, Papain-like_cys_pep_sf","GO:0004843,GO:0008270,GO:0006511,GO:0016579","cysteine-type deubiquitinase activity,zinc ion binding,ubiquitin-dependent protein catabolic process,protein deubiquitination","TO_0006002, TO_0000430, TO_0000276","proline content, germination rate, drought tolerance","0.017954818","0.037495005","0.079806189","0.130749923","0.097817023","0.224904336"
"TraesCS7B03G0670100.1","TraesCS7B02G240300","W22","0.86332556976088","8.07112473327412e-06","","","NA","NA","NA","NA","0.115123678","0","0.970600272","0.989841211","0.784763877","1.454209903"
"TraesCS7B03G0731400.1","TraesCS7B02G266900","W22","0.816227223029362","6.43692501390316e-05","IPR000504, IPR012677, IPR035979","RRM_dom, Nucleotide-bd_a/b_plait_sf, RBD_domain_sf","GO:0010468,GO:0003729,GO:0005654","regulation of gene expression,mRNA binding,nucleoplasm","TO_0000180, TO_0000469, TO_0002661, TO_0000249","spikelet fertility, days to maturity, seed maturation, leaf senescence trait","1.182368023","1.162237854","1.532732779","1.088255291","2.614516545","3.453526828"
"TraesCS7B03G0911600.1","TraesCS7B02G339600","W22","0.869721244458849","5.74447951447105e-06","IPR013187, IPR017451, IPR036047","F-box-assoc_dom_typ3, F-box-assoc_interact_dom, F-box-like_dom_sf","GO:0005515","protein binding","TO_0006001, TO_0000112, TO_0002681, TO_0000429, TO_0002657, TO_0000310, TO_0000183, TO_0006019, TO_0000608, TO_0020097","salt tolerance, disease resistance, leaf curling, salt sensitivity, oxidative stress, self-incompatibility, other miscellaneous trait, floral organ identity, sodium content, stomatal opening","0.055842067","0","0.349601756","0.202824366","0.368189974","1.150495218"
"TraesCS7B03G1296600.1","TraesCS7B02G481900","W22","0.831655527136893","3.49737644450866e-05","IPR001810, IPR011043, IPR036047","F-box_dom, Gal_Oxase/kelch_b-propeller, F-box-like_dom_sf","GO:0005515","protein binding","TO_0000276","drought tolerance","0.147897953","0.024912547","1.076845659","0.214398457","0.49064689","1.047002251"
"TraesCS7D03G0211500.1","TraesCS7D02G093000","W22","0.876391203990631","3.95207328379952e-06","IPR000504, IPR012677, IPR035979","RRM_dom, Nucleotide-bd_a/b_plait_sf, RBD_domain_sf","GO:0003729","mRNA binding","TO_0002661","seed maturation","0.362896331","0.296528733","0.853639414","0.456921643","0.966615099","1.371164216"
"TraesCS7D03G0389900.1","TraesCS7D02G172300","W22","0.757161400957384","0.000432506429262669","IPR007378","Tic22-like","GO:0009507,GO:0015031","chloroplast,protein transport","TO_0000366, TO_0000183","reproductive growth time, other miscellaneous trait","0.446811335","0.538079557","1.10179275","0.490966118","1.145049363","1.571578489"
"TraesCS7D03G0510700.1","TraesCS7D02G229400","W22","0.689525639536025","0.00219575877058188","","","NA","NA","NA","NA","3.372358087","5.287874023","13.57781235","4.334299355","8.233246701","13.56122249"
"TraesCS7D03G0537900.1","TraesCS7D02G241100","W22","0.760208756832387","0.000397247651037338","IPR001404, IPR003594, IPR019805, IPR020568, IPR020575, IPR036890, IPR037196","Hsp90_fam, HATPase_C, Heat_shock_protein_90_CS, Ribosomal_S5_D2-typ_fold, Hsp90_N, HATPase_C_sf, HSP90_C","GO:0005829,GO:0005886,GO:0032991,GO:0048471,GO:0005524,GO:0016887,GO:0051082,GO:0006457,GO:0034605,GO:0050821","cytosol,plasma membrane,protein-containing complex,perinuclear region of cytoplasm,ATP binding,ATP hydrolysis activity,unfolded protein binding,protein folding,cellular response to heat,protein stabilization","TO_0000421, TO_0000112, TO_0000366, TO_0006054, TO_0000146, TO_0000181, TO_0002639, TO_0002692, TO_0000315, TO_0006013, TO_0000514, TO_0006002, TO_0000391, TO_0000207, TO_0002661, TO_0000975, TO_0000495, TO_0006036, TO_0000043, TO_0000696, TO_0006067, TO_0000430, TO_0000276, TO_0006050, TO_0002657, TO_0020097, TO_0000492, TO_0002637, TO_0000183","pollen fertility, disease resistance, reproductive growth time, arsenic concentration, seed length, seed weight, shoot branching, root meristem development, bacterial disease resistance, carpel number, potassium uptake, proline content, seed size, plant height, seed maturation, grain width, chlorophyll content, stem elongation, root morphology trait, starch content, aphid resistance, germination rate, drought tolerance, cobalt concentration, oxidative stress, stomatal opening, leaf shape, leaf size, other miscellaneous trait","18.94770503","16.73271541","33.43723035","18.45878304","46.6702993","43.08086481"
"TraesCS7D03G0825700.1","TraesCS7D02G349900","W22","0.693821597117684","0.0020058628537589","IPR001806, IPR002041, IPR005225, IPR027417","Small_GTPase, Ran_GTPase, Small_GTP-bd_dom, P-loop_NTPase","GO:0005525,GO:0005634,GO:0000054,GO:0005737,GO:0003924,GO:0006606","GTP binding,nucleus,ribosomal subunit export from nucleus,cytoplasm,GTPase activity,protein import into nucleus","NA","NA","5.855026341","8.75187192","10.91222404","17.8702008","17.21143297","24.83762666"
"TraesCS7D03G0922400.1","TraesCS7D02G391200","W22","0.85399096898931","1.28765187322057e-05","","","NA","NA","NA","NA","0","0.124363434","1.791871176","1.071734168","1.264771445","2.712418776"
"TraesCS7D03G0947700.1","TraesCS7D02G402300","W22","0.891807977895301","1.52427490479774e-06","IPR003099, IPR008927, IPR028939, IPR036291, IPR045011","Prephen_DH, 6-PGluconate_DH-like_C_sf, P5C_Rdtase_cat_N, NAD(P)-bd_dom_sf, TYRAAT1/2","GO:0004665,GO:0008977,GO:0033730,GO:0006571","prephenate dehydrogenase (NADP+) activity,prephenate dehydrogenase (NAD+) activity,arogenate dehydrogenase (NADP+) activity,tyrosine biosynthetic process","TO_0000183, TO_0000355, TO_0006001","other miscellaneous trait, heterosis, salt tolerance","5.433570398","3.072618832","15.91319062","12.34676985","25.89977407","46.20144481"
"TraesCS7D03G1017200.1","TraesCS7D02G430100","W22","0.829756432937333","3.78218629857601e-05","","","NA","NA","NA","NA","0.062114754","0","0.242349235","0.189297975","0.167945158","0.5151702"
"TraesCS7D03G1084000.1","TraesCS7D02G456500","W22","0.895526574384183","1.18572003682172e-06","IPR003676","SAUR_fam","GO:0009733","response to auxin","TO_0000227, TO_0006001","root length, salt tolerance","0.072774611","0.11103878","1.645299403","0.514591085","1.445892939","2.401226507"
